source_id,source_name,author,title,description,url,urlToImage,publishedAt,content
,STYLECASTER,Lea Veloso,Kate Seemingly Responded to ‘Evil’ Rumors Her New Blonde Hair Is a Wig Amid Reports She’s ‘Struggling Behind Closed Doors’ Post-Cancer - yahoo.com,What did she do?,https://stylecaster.com/entertainment/celebrity-news/1234852307/kate-middleton-brunette-hair/,https://s.yimg.com/ny/api/res/1.2/werLpfJX5EvNQD7627OzHQ--/YXBwaWQ9aGlnaGxhbmRlcjt3PTEyMDA7aD02NzQ7Y2Y9d2VicA--/https://media.zenfs.com/en/stylecaster_935/16cb6ff866a5a60823d9dd68f594bb6c,2025-09-08 14:37:40+00:00,"She might be going back to the basics. Kate Middleton just seemingly dyed her hair again after she was accused of wearing a blonde wig.
The Princess of Wales debuted a brunette look at the Womens Ru… [+3056 chars]"
,Variety,Zack Sharf,Ayo Edebiri Says #MeToo and Black Lives Matter Aren’t Dead After Interviewer Asks Only Her White Co-Stars Julia Roberts and Andrew Garfield to Respond: ‘I Don’t Know If That’s Purposeful That’s Not for Me’ - Variety,Ayo Edebiri says #MeToo and Black Lives Matter are not dead after only her white co-stars Julia Roberts and Andrew Garfield got asked to respond.,https://variety.com/2025/film/news/ayo-edebiri-me-too-black-lives-matter-not-dead-interview-1236511707/,https://variety.com/wp-content/uploads/2025/09/GettyImages-2231976239.jpg?w=1000&h=563&crop=1,2025-09-08 14:35:00+00:00,"Ayo Edebiri is being praised on social media for how she handled an uncomfortable interview moment while promoting her new movie, “After the Hunt,” at the Venice Film Festival. “The Bear” Emmy winner… [+2064 chars]"
,NPR,Keller Gordon,"After 6 years, Hollow Knight Silksong is here at last — and it was worth the wait - NPR","Hollow Knight was a Kickstarter-backed project that obliterated expectations. Now, after years of rumors, memes and anticipation, the three-person indie developer Team Cherry has delivered the sequel.",https://www.npr.org/2025/09/08/nx-s1-5533199/hollow-knight-silksong,https://npr.brightspotcdn.com/dims3/default/strip/false/crop/1833x1030+279+297/resize/1400/quality/100/format/png/?url=http%3A%2F%2Fnpr-brightspot.s3.amazonaws.com%2F69%2F5a%2F5376534749db93c63eccfda303c8%2F07-clover.png,2025-09-08 14:32:05+00:00,"The Savage Beastfly takes prisoners. Their cages fall from the ceiling as it charges directly at your lithe, red-cloaked figure. Somehow, it manages to track your nimble movement and futile flips and… [+4296 chars]"
the-washington-post,The Washington Post,"Lauren Weber, Lena H. Sun",RFK Jr. considers critics of coronavirus shots to join key vaccine panel - The Washington Post,"Two urged removal of mRNA coronavirus vaccines. One said physicians “blindly believed” in them. Another said covid isn’t “scary,” noting Jesus touched lepers.",https://www.washingtonpost.com/health/2025/09/08/rfk-jr-new-vaccine-advisers/,https://www.washingtonpost.com/wp-apps/imrs.php?src=https://arc-anglerfish-washpost-prod-washpost.s3.amazonaws.com/public/336ZMIQEZZE5KSHAQY6NWIWT4M_size-normalized.jpg&w=1440,2025-09-08 14:31:51+00:00,"Health and Human Services Secretary Robert F. Kennedy Jr. has been weighing whether to add new members to the committee that recommends which vaccines Americans should receive, according to two forme… [+103 chars]"
,Motor1 ,Chris Perkins,Watch the Hybrid Porsche 911 Turbo S Rip Around the Nürburgring - Motor1.com,"With racer Jörg Bergmeister at the wheel, the new Turbo S set a 7:03.92 around the Nordschleife. That's 14 seconds quicker than the old Turbo S.",https://www.motor1.com/news/771564/porsche-992-turbo-s-hybrid-nurburgring-time/,https://cdn.motor1.com/images/mgl/Zn1Mbr/s1/911-turbo-s-nurburgring.jpg,2025-09-08 14:30:33+00:00,"The Porsche 911 Turbo S has gone hybrid, and unsurprisingly, its very quick. With 701 horsepower alongside significant chassis and aerodynamic tweaks, Porsche claims a 14-second improvement over its … [+2856 chars]"
,Kotaku,Ethan Gach,How To Beat Silksong's First Boss: A Guide To The Bell Beast - Kotaku,The Bell Beast is Silksong's first hurdle for new players to overcome,https://kotaku.com/silksong-first-boss-bell-beast-guide-2000624015,https://kotaku.com/app/uploads/2025/09/Bell-Beast.jpg,2025-09-08 14:26:23+00:00,"There are ways in which Hollow Knight: Silksong can be a bit more difficult than its predecessor. For players new to the Metroidvania Soulslike series, it can feel a bit like taking a plunge in a col… [+2889 chars]"
,Investor's Business Daily,,Tesla EV Sales Are Struggling But Elon Musk Looks To The Future For Value - Investor's Business Daily,Tesla market share in the U.S. has fallen to its lowest level in nearly eight years.,https://www.investors.com/news/tesla-ev-sales-struggling-elon-musk-looking-to-future/,https://www.investors.com/wp-content/uploads/2025/01/Stock-Tesla-NewModelY-02-company.jpg,2025-09-08 14:25:00+00:00,"Information in Investors Business Daily is for informational and educational purposes only and should not be construed as an offer, recommendation, solicitation, or rating to buy or sell securities. … [+1064 chars]"
,9to5google.com,Will Sattelberg,Nothing Ear (3) are set for a September 18th launch as the company teases new look - 9to5Google,"After a busy 2025, Nothing Ear (3) could help the brand retain its audio crown, though it's unclear what's changed just yet.",http://9to5google.com/2025/09/08/nothing-ear-3-are-set-for-a-september-18th-launch-as-the-company-teases-new-look/,https://i0.wp.com/9to5google.com/wp-content/uploads/sites/4/2024/11/nothing-ear-3.jpg?resize=1200%2C628&quality=82&strip=all&ssl=1,2025-09-08 14:22:00+00:00,"It’s been a busy 2025 for Nothing, having launched a trio of smartphones alongside the brand’s first-ever over-the-ear headphones, but that doesn’t mean the rest of the year is quieting down.
Just a… [+1216 chars]"
,Rolling Stone,Alex Edelman,How the Oasis Reunion Became the Feel-Good Event of the Year - Rolling Stone,"Many thought the Oasis tour would never happen. Instead, it did — and the vibes are immaculate.",http://www.rollingstone.com/music/music-features/oasis-reunion-tour-gallagher-brothers-1235422640/,https://www.rollingstone.com/wp-content/uploads/2025/09/oasis-is-a-vibe.jpg?w=1600&h=900&crop=1,2025-09-08 14:21:20+00:00,My favorite moment from the Oasis show wasn’t watching them sing “Wonderwall” or “Champagne Supernova.” It wasn’t the fireworks at the end of the night or Liam Gallagher’s growling banter. My favorit… [+6232 chars]
,Phys.Org,University of Bristol,Multiple new species of 'living fossil' fish found hiding in plain sight after more than 150 years - Phys.org,"The modern coelacanth is a famous ""living fossil,"" long thought to have died out, but first fished out of deep waters in the Indian Ocean in 1938. Since then, dozens of examples have been found, but their fossil history is patchy.",https://phys.org/news/2025-09-multiple-species-fossil-fish-plain.html,https://scx2.b-cdn.net/gfx/news/hires/2025/multiple-new-species-o.jpg,2025-09-08 14:20:04+00:00,"The modern coelacanth is a famous ""living fossil,"" long thought to have died out, but first fished out of deep waters in the Indian Ocean in 1938. Since then, dozens of examples have been found, but … [+3002 chars]"
,NPR,,This is what could happen to a child who doesn't get vaccinated - NPR,"An estimated 14 million kids don't get any vaccines. They face serious threats from measles, diarrhea, pneumonia and more.",https://www.npr.org/sections/goats-and-soda/2025/09/08/g-s1-87121/vaccines-measles-diarrhea-pneumonia-sudan,https://npr.brightspotcdn.com/dims3/default/strip/false/crop/1804x1015+226+154/resize/1400/quality/100/format/png/?url=http%3A%2F%2Fnpr-brightspot.s3.amazonaws.com%2F3e%2F67%2Fbe7c4b26488eab2be4a2a08d7be6%2Fgoats-dtp-vax-promo.png,2025-09-08 14:16:13+00:00,"Pneumonia struck first. Then tonsillitis spiraled into sepsis. Malaria battered him next, and after treatment, the other illnesses flared back up again. This unvaccinated 2-year-old boy is trapped in… [+13047 chars]"
,Boing Boing,,"AI-powered eavesdropping ""Friend"" gadget reviewed - Boing Boing",,https://boingboing.net/2025/09/08/ai-powered-eavesdropping-gadgets-reviewed.html,,2025-09-08 14:12:13+00:00,Description: Group Number: Group Name: Ip Address: Username: Computer Name:
,PsyPost,Vladimir Hedrih,Single dose of psilocybin linked to lasting symptom relief in treatment-resistant depression - PsyPost,A small pilot study found that a single 25 mg dose of psilocybin led to lasting reductions in depression symptoms among U.S. military veterans with treatment-resistant depression. Half were in remission after six months; 30% remained in remission at one year.,https://www.psypost.org/single-dose-of-psilocybin-linked-to-lasting-symptom-relief-in-treatment-resistant-depression/,https://www.psypost.org/wp-content/uploads/2025/09/dried-psilocybin-mushrooms.jpg,2025-09-08 14:11:20+00:00,A new study of U.S. military veterans suffering from severe treatment-resistant depression found that a single dose of psilocybin was associated with significant reductions in depressive symptoms tha… [+5861 chars]
,Electrek,Peter Johnson,"The Volkswagen ID.Cross delivers the ‘secret sauce’ as an affordable, sleek electric SUV - Electrek",Is the ID.Cross the low-cost SUV we’ve been waiting for? The Volkswagen ID.Cross debuted at the Munich Motor Show with...,http://electrek.co/2025/09/08/volkswagen-id-cross-has-secret-sauce-as-an-affordable-ev/,https://i0.wp.com/electrek.co/wp-content/uploads/sites/3/2025/09/Volkswagen-ID.Cross-affordable-SUV.jpeg?resize=1200%2C628&quality=82&strip=all&ssl=1,2025-09-08 14:06:00+00:00,"The Volkswagen ID.Cross affordable electric SUV concept (Source: Volkswagen AG)
Is the ID.Cross the low-cost SUV weve been waiting for? The Volkswagen ID.Cross debuted at the Munich Motor Show with … [+2664 chars]"
,Hollywood Reporter,Zosia Mamet,Why Zosia Mamet Quit One of the Biggest Shows on Television (Exclusive Excerpt) - The Hollywood Reporter,"In an excerpt from her new collection of essays, 'Does This Make Me Funny?,' the 37-year-old actress — daughter of David, Shoshanna on 'Girls' — recalls the on-set showrunner freakouts she experienced early in her career.",http://www.hollywoodreporter.com/lifestyle/arts/why-zosia-mamet-quit-biggest-show-television-excerpt-1236362968/,https://www.hollywoodreporter.com/wp-content/uploads/2025/09/ZM-Headshot-Alexandra-Arnold.jpg?crop=0px%2C146px%2C3840px%2C2148px&resize=1440%2C810,2025-09-08 14:01:15+00:00,"“I can’t find my scissors so we’re gonna have to use a straight razor.”
It’s six in the morning. I’m sitting in a makeup trailer in downtown LA in a parking lot next to the river. I’ve landed a recu… [+8803 chars]"
,Space.com,Stefanie Waldek,Juno spacecraft finds auroral 'footprints' of Jupiter's moon Callisto for 1st time - Space,"Yes, even Jupiter's moons produce auroras.",https://www.space.com/astronomy/jupiter/juno-spots-callisto-aurora,https://cdn.mos.cms.futurecdn.net/j9ffYVYRvA7hdUq5dAegPS.jpg,2025-09-08 14:00:00+00:00,"In a landmark observation by a team of international researchers, NASA's Juno spacecraft has, for the first time, clearly detected the auroras of Jupiter's moon Callisto. This discovery completes the… [+2754 chars]"
the-verge,The Verge,Andrew Webster,Arco is stunning sci-fi with shades of Moebius and Miyazaki - The Verge,"TIFF 2025 film reviews including the movies Arco, Good Fortune, and Sacrifice.",https://www.theverge.com/toronto-international-film-festival/773517/tiff-2025-reviews-arco-good-fortune-sacrifice,https://platform.theverge.com/wp-content/uploads/sites/2/2025/09/ARCO_Still_01_CourtesyofNEON.jpeg?quality=90&strip=all&crop=0%2C3.5250663415334%2C100%2C92.949867316933&w=1200,2025-09-08 14:00:00+00:00,"<ul><li></li><li></li><li></li></ul>
Reviews from day 4 of TIFF 2025: Arco, Good Fortune, and Sacrifice.
Reviews from day 4 of TIFF 2025: Arco, Good Fortune, and Sacrifice.
by
Andrew WebsterClose… [+4560 chars]"
,NASA,NASA Webb Mission Team,"NASA Webb Looks at Earth-Sized, Habitable-Zone Exoplanet TRAPPIST-1 e - NASA Science (.gov)",Scientists are in the midst of observing the exoplanet TRAPPIST-1 e with NASA’s James Webb Space Telescope. Careful analysis of the results so far presents,https://science.nasa.gov/missions/webb/nasa-webb-looks-at-earth-sized-habitable-zone-exoplanet-trappist-1-e/,https://assets.science.nasa.gov/content/dam/science/missions/webb/science/2025/09/STScI-01K1V61D55HJV2956SNSEN15GN.tif/jcr:content/renditions/cq5dam.web.1280.1280.jpeg,2025-09-08 14:00:00+00:00,Scientists are in the midst of observing the exoplanet TRAPPIST-1 e with NASAs James Webb Space Telescope. Careful analysis of the results so far presents several potential scenarios for what the pla… [+6593 chars]
,Forbes,Paul Tassi,The ‘Borderlands 4’ Release Dates And Global Launch Times - Forbes,Here are the release dates and times for Borderlands 4 in your region. so you can plan your gaming time ahead of release.,https://www.forbes.com/sites/paultassi/2025/09/08/the-borderlands-4-release-dates-and-global-launch-times/,"https://imageio.forbes.com/specials-images/imageserve/68bee03cc51586818364a156/0x0.jpg?format=jpg&crop=747,420,x581,y214,safe&height=900&width=1600&fit=bounds",2025-09-08 13:59:07+00:00,"Borderlands 4 is nearly here after six years of waiting, and fans are no doubt wondering exactly when they can get their hands on the game. Well, the release time and technically, even the release da… [+2426 chars]"
,Investor's Business Daily,,Stock Market Today: Dow Falls Ahead Of Key Inflation Data; Tesla Touches Buy Point (Live Coverage) - Investor's Business Daily,Stock Market Today: The Dow Jones index fell Monday ahead of this week's key inflation data. Tesla stock touched a new buy point.,https://www.investors.com/market-trend/stock-market-today/dow-jones-sp500-nasdaq-inflation-data-tesla-stock-tsla-buy-point/,https://www.investors.com/wp-content/uploads/2025/07/Stock-wallstreet-multiflag-01-adobe.jpg,2025-09-08 13:55:00+00:00,"Information in Investors Business Daily is for informational and educational purposes only and should not be construed as an offer, recommendation, solicitation, or rating to buy or sell securities. … [+1064 chars]"
,Phoronix,,First Benchmarks Of Windows 11 25H2 vs. Ubuntu 25.10 On AMD Ryzen 9 9950X - Phoronix,Microsoft is preparing to ship Windows 11 25H2 as their newest incremental update to their operating system.,https://www.phoronix.com/review/windows-11-25h2-ubuntu-2510,https://www.phoronix.net/image.php?id=windows-11-25h2-ubuntu-2510&image=windows_11_25h2_1,2025-09-08 13:55:00+00:00,Microsoft is preparing to ship Windows 11 25H2 as their newest incremental update to their operating system. Windows 11 25H2 is currently available via their preview channel in advance of the formal … [+1289 chars]
,9to5Mac,Ben Lovejoy,"Apple Calendar spam on the rise again, mostly crypto scams - 9to5Mac","We first saw Apple Calendar spam almost a decade ago, when it hit such levels that the iPhone maker issued...",https://9to5mac.com/2025/09/08/apple-calendar-spam-on-the-rise-again-mostly-crypto-scams/,https://i0.wp.com/9to5mac.com/wp-content/uploads/sites/6/2025/09/Apple-Calendar-spam-on-the-rise-again-mostly-crypto-scams.jpg?resize=1200%2C628&quality=82&strip=all&ssl=1,2025-09-08 13:53:00+00:00,"We first saw Apple Calendar spam almost a decade ago, when it hit such levels that the iPhone maker issued an apology and said that it was blocking suspicious senders.
We’ve seen the problem re-emer… [+1013 chars]"
,Sports Illustrated,Dave Feit,"Dave Feit: The Huskers Flattened the Zips, and It Was 1982 All Over Again - Sports Illustrated","The power of a blowout win is good, even against a cupcake opponent.",https://www.si.com/college/nebraska/football/dave-feit-the-huskers-flattened-the-zips-and-it-was-1982-all-over-again-huskers-akron-matt-rhule-big-ten-dylan-raiola,"https://images2.minutemediacdn.com/image/upload/c_crop,w_3800,h_2137,x_0,y_0/c_fill,w_1440,ar_16:9,f_auto,q_auto,g_auto/images/voltaxMediaLibrary/mmsport/all_huskers/01k4je215z45qr3grkf1.jpg",2025-09-08 13:52:10+00:00,"The 68-0 annihilation of Akron was a throwback game. 
Sitting in the stands, it reminded me of my college years (1993-1997) where Nebraska would routinely dominate and/or dismantle non-conference op… [+15583 chars]"
,TechSpot,TechSpot,No wearables needed: researchers use WiFi and Raspberry Pi to measure your heart rate in real time - TechSpot,,https://www.techspot.com/news/109367-no-wearables-needed-researchers-use-wifi-raspberry-pi.html,,2025-09-08 13:44:00+00:00,
,BBC News,,New Banksy mural appears at Royal Courts of Justice - BBC,"The artwork, which shows a judge hitting a protester with a gavel, was confirmed by the elusive street artist.",https://www.bbc.com/news/articles/cgrq0r0y878o,https://ichef.bbci.co.uk/news/1024/branded_news/b253/live/6a2bf1d0-8ca6-11f0-84c8-99de564f0440.jpg,2025-09-08 13:39:23+00:00,"A new mural by elusive street artist Banksy has appeared on the side of the Royal Courts of Justice building in central London.
It depicts a judge in a traditional wig and black robe hitting a prote… [+2598 chars]"
,Rolling Stone,David Fear,‘Hamnet’ Is the Most Shattering Movie of 2025 - Rolling Stone,"Jessie Buckley, Paul Mescal and Chloé Zhao turn the Bard's defining tragedy into a heartbreaking portrait of love, loss, and the healing power of art.",http://www.rollingstone.com/tv-movies/tv-movie-reviews/hamnet-review-paul-mescal-jessie-buckley-1235420381/,https://www.rollingstone.com/wp-content/uploads/2025/09/REV_4238_D005_00229_R.jpg?w=1600&h=900&crop=1,2025-09-08 13:30:00+00:00,"She’s a woman who feels most at home in the natural world, curling up on forest floors in rural England and displaying a gift for falconry. He’s a young Latin tutor, barely out of his teens, desperat… [+7782 chars]"
,TheGamer,Jack Coleman,"Randy Pitchford Says Borderlands 4 Running Below Minimum Specs Would Be A ""Miracle"" - TheGamer","Randy Pitchford says Borderlands 4's day one patch will be hefty, but don't expect to run be able to run the game on older hardware.",https://www.thegamer.com/borderlands-4-minimum-specifcations-randy-pitchford-day-one-patch/,https://static0.thegamerimages.com/wordpress/wp-content/uploads/2025/09/borderlands-4-psycho-staring-down-player-with-axe.jpg?w=1600&h=900&fit=crop,2025-09-08 13:30:00+00:00,"We're just a few short days from the release of Borderlands 4, a game which I quite enjoyed during my hands-on session at Gamescom. 
Borderlands 4 is set to be the first instalment in the series wit… [+2016 chars]"
,Tipranks.com,Gabe Ross,Is Broadcom a Millionaire Maker? Here’s What This Top Investor Thinks - TipRanks,"It is hard to argue with the recent results of Broadcom (NASDAQ:AVGO), which delivered a sparkling 3Q Fiscal 2025 earnings report late last week. The company enjoye...",https://www.tipranks.com/news/is-broadcom-a-millionaire-maker-heres-what-this-top-investor-thinks,https://blog.tipranks.com/wp-content/uploads/2025/09/shutterstock_2454837739-750x406.jpg,2025-09-08 13:28:37+00:00,
,Tom's Guide,Sam Hopes,New study says you can boost longevity with just 60 seconds of exercise a day —here's how - Tom's Guide,Research suggests you can benefit from just one minute of movement.,https://www.tomsguide.com/wellness/fitness/exercise-for-just-60-seconds-and-live-longer-new-study-says-heres-how,https://cdn.mos.cms.futurecdn.net/xpGDQvhJngcNfcLQd3T9PL.jpg,2025-09-08 13:27:28+00:00,"The dream is that we could all work out less and get better results, right? Well, a new study suggests that just 60 seconds of “incidental exertion,” meaning activity that you happen upon or is unpla… [+4694 chars]"
,Investor's Business Daily,"ALLISON GATLIN, Investor's Business Daily",Summit's High-Profile Drug Flops And Shares Crash - Investor's Business Daily,Summit Therapeutics stock crashed Monday after the company's drug failed to meet the bar for overall survival in lung cancer.,https://www.investors.com/news/technology/summit-therapeutics-stock-pd-1-vegf-lung-cancer-treatment/,https://www.investors.com/wp-content/uploads/2024/09/Stock-SummitTherapeutics-01-shutt.jpg,2025-09-08 13:15:00+00:00,"Summit Therapeutics (SMMT) stock crashed Monday after the company's high-profile drug failed to meet the bar for overall survival in patients with advanced lung cancer.
The company tested a combinat… [+1940 chars]"
,9to5Mac,Ben Lovejoy,Bose QuietComfort Ultra headphones will get a 2nd-gen update next month - 9to5Mac,"The popular Bose QuietComfort Ultra headphones already got one update back in the summer, but the company has now announced...",https://9to5mac.com/2025/09/08/bose-quietcomfort-ultra-headphones-will-get-a-2nd-gen-update-next-month/,https://i0.wp.com/9to5mac.com/wp-content/uploads/sites/6/2025/09/bose-qc-ultra-gen2.jpg?resize=1200%2C628&quality=82&strip=all&ssl=1,2025-09-08 13:09:00+00:00,"The popular Bose QuietComfort Ultra headphones already got one update back in the summer, but the company has now announced a bigger update deserving of a 2nd-generation label…
Back in June, the com… [+1827 chars]"
,Space.com,Nola Taylor Tillman,"1st known interstellar visitor 'Oumuamua is an 'exo-Pluto' — a completely new class of object, scientists say - Space","""'Oumuamua is in a different category of object. It's much harder to find, but there are a lot more of them.""",https://www.space.com/astronomy/dwarf-planets/1st-known-interstellar-visitor-oumuamua-is-an-exo-pluto-a-completely-new-class-of-object-scientists-say,https://cdn.mos.cms.futurecdn.net/LMb8KTcYp38wBrWFrzBXMj.jpg,2025-09-08 13:00:00+00:00,"The first interstellar object to visit the solar system may have been a fragment of an icy exoplanet, research suggests.
When 1I/'Oumuamua was first spotted in 2017, astronomers quickly determined t… [+7727 chars]"
,Dailynous.com,Justin Weinberg,Philosophy’s Journal Problem Captured in One Number? - dailynous.com,"The number of articles accepted by a top philosophy journal in the first six months of 2025: 1. So reports The Journal of Philosophy. Here are the journal's 2025 statistics through July 1st, as reported on its memo to authors page: Total submissions: 403 Desk…",https://dailynous.com/2025/09/08/philosophys-journal-problem-captured-in-one-number/,https://dailynous.com/wp-content/uploads/2025/09/one-scaffolding.png,2025-09-08 12:59:57+00:00,I see several problems with the Journal of Philosophy’s reporting here. I recognize that others have already tried to defend the journal but I think those defenses are very poor (if nonetheless under… [+2838 chars]
,Deadline,Ted Johnson,Howard Stern Returns To SiriusXM Show After Prank That He’d Departed & Been Replaced By Andy Cohen - Deadline,"Stern pulled a prank at the top of his show, but said media reports he was leaving were inaccurate.",http://deadline.com/2025/09/howard-stern-reterns-siriusxm-1236511807/,https://deadline.com/wp-content/uploads/2024/10/GettyImages-1782645874.jpg?w=1024,2025-09-08 12:51:00+00:00,"Howard Stern successfully pranked viewers and a few media outlets on Monday during his return to his SiriusXM show after a summer hiatus.
Following media speculation that he was exiting his longtime… [+1720 chars]"
,Nintendo Life,Ollie Reynolds,"""The Most Impressive Switch 2 Port To Date"" - Digital Foundry Examines Star Wars Outlaws - Nintendo Life",Gotta trace those rays,https://www.nintendolife.com/news/2025/09/the-most-impressive-switch-2-port-to-date-digital-foundry-examines-star-wars-outlaws,https://images.nintendolife.com/cba56dba0fd39/large.jpg,2025-09-08 12:45:00+00:00,"Watch on YouTube
Subscribe to Nintendo Life on YouTube834k
Star Wars Outlaws is out now on the Switch 2 (a fact you might have missed thanks to last week's furore around Hollow Knight: Silksong) an… [+1910 chars]"
associated-press,Associated Press,Danica Kirka,Prince Harry visits late queen’s grave as UK visit fuels speculation about meeting with King Charles - AP News,"Prince Harry has planned a flying visit to his U.K.-based charities this week, sparking speculation about a potential meeting with his father, King Charles III. British media suggest it could be an opportunity for reconciliation. The trip coincides with the t…",https://apnews.com/article/britain-prince-harry-wellchild-reconciliation-charles-royals-06359538088622e21e6465630325c56e,https://dims.apnews.com/dims4/default/3a1e5dc/2147483647/strip/true/crop/3246x1826+0+169/resize/1440x810!/quality/90/?url=https%3A%2F%2Fassets.apnews.com%2Ffc%2F3e%2F757d53a6a4952770a883349e3324%2F95eda9e8cef7491fa30ea7b92bd82ded,2025-09-08 12:45:00+00:00,"LONDON (AP) Prince Harry arrived in the U.K. on Monday leading to speculation about whether he will meet with his father, King Charles III, for the first time in 19 months.
Amid signs of a thaw in t… [+5038 chars]"
,Nature.com,,‘Amazing feat’: US man still alive six months after pig kidney transplant - Nature,The first six months after an organ transplant are the riskiest for recipients.,https://www.nature.com/articles/d41586-025-02851-w,https://media.nature.com/lw1200/magazine-assets/d41586-025-02851-w/d41586-025-02851-w_51424302.jpg,2025-09-08 12:38:01+00:00,
