source_id,source_name,author,title,description,url,urlToImage,publishedAt,content
,KGW.com,Sabinna Pierre,Grandparents for Vaccines launches to share stories of life before immunizations - KGW,New volunteer group aims to educate parents about vaccine importance by sharing personal experiences with preventable diseases.,https://www.kgw.com/article/news/health/grandparents-for-vaccines-stories-life-before-immunizations/283-27bf3ad5-ca2f-4df8-afb6-255d25e62931,https://media.kgw.com/assets/KGW/images/b1ecc4b8-8317-409d-a71f-c7b5d370b47c/b1ecc4b8-8317-409d-a71f-c7b5d370b47c_1140x641.jpg,2025-09-08 12:32:00+00:00,"OREGON, USA A new volunteer-led organization called Grandparents for Vaccines launched Sunday on National Grandparents Day with a mission to share firsthand experiences of life before vaccines were w… [+1715 chars]"
associated-press,Associated Press,Alex Veiga,Shortage of homebuyers forces many sellers to lower prices or walk away as sales slump drags on - AP News,"The housing market is becoming more buyer-friendly after years of sharply rising prices. Many Americans still can't afford homes, but those who can are finding that they have leverage to press sellers for better deals, such as lower prices and cash for closin…",https://apnews.com/article/real-estate-housing-market-home-prices-6a2ae673d0c93e98b69d3c6b99925124,https://dims.apnews.com/dims4/default/2b86ccb/2147483647/strip/true/crop/3936x2214+0+209/resize/1440x810!/quality/90/?url=https%3A%2F%2Fassets.apnews.com%2Fac%2F68%2F3b87cbef9a985f07c467128d7b82%2F60f23c96d07c466995d2b06c5946e500,2025-09-08 12:19:00+00:00,"LOS ANGELES (AP) Skyrocketing housing values and a shortage of homes on the market gave homeowners the upper hand for years when it came time to sell. Thats no longer a given.
Across the country, it… [+7341 chars]"
cnn,CNN,Jordan Valinsky,Amazon is eliminating one of its most generous perks - CNN,"If you’re sharing the Amazon Prime membership of a family member or friend outside your household, prepare to pay up.",https://www.cnn.com/2025/09/08/tech/amazon-prime-invitee-shipping-changes,"https://media.cnn.com/api/v1/images/stellar/prod/gettyimages-2187383581.jpg?c=16x9&q=w_800,c_fill",2025-09-08 12:13:00+00:00,"If youre sharing the Amazon Prime membership of a family member or friend outside your household, prepare to pay up.
Beginning October 1, the company is eliminating Prime Invitee, a program that let… [+1271 chars]"
,Lawfaremedia.org,,Anthropic’s Settlement Shows the U.S. Can’t Afford AI Copyright Lawsuits - Lawfare,Copyright plaintiffs are squeezing enormous sums from AI companies. That's bad for the US and great for China. It's time for President Trump to invoke the Defense Production Act and resolve the crisis.,https://www.lawfaremedia.org/article/anthropic-s-settlement-shows-the-u.s.-can-t-afford-ai-copyright-lawsuits,,2025-09-08 12:09:31+00:00,Anthropic just paid $1.5 billion to settle a copyright case that it largely won in district court. Future litigants are likely to hold out for much more. A uniquely punitive provision of copyright la… [+19550 chars]
,TechSpot,Skye Jacobs,Biden-era noncompete ban collapses as FTC pulls back - TechSpot,"The decision came just ahead of a court-imposed deadline. The Fifth Circuit Court of Appeals had issued repeated delays at the request of the Trump administration, whose...",https://www.techspot.com/news/109365-biden-era-noncompete-ban-collapses-ftc-withdraws-appeal.html,https://www.techspot.com/images2/news/bigimage/2025/09/2025-09-08-image.jpg,2025-09-08 12:09:00+00:00,"What just happened? The Federal Trade Commission has abandoned its effort to defend a nationwide ban on employment noncompete agreements, bringing an end to one of the most high-profile regulatory in… [+4073 chars]"
,Yahoo Entertainment,"Joel S. Levine, William & Mary","50 years ago, NASA sent 2 spacecraft to search for life on Mars – the Viking missions’ findings are still discussed today - yahoo.com",The Viking missions paved the way for future Mars missions and helped researchers understand the red planet’s climate and geology.,https://www.yahoo.com/news/articles/50-years-ago-nasa-sent-120712242.html,https://s.yimg.com/ny/api/res/1.2/IVoA4YIfpwHqBTvdGlVv_g--/YXBwaWQ9aGlnaGxhbmRlcjt3PTEyMDA7aD02NzU7Y2Y9d2VicA--/https://media.zenfs.com/en/the_conversation_us_articles_815/10bec37bd33a72d564016dbab165c43c,2025-09-08 12:07:12+00:00,"Finding life beyond the Earth would be a major scientific discovery with significant implications for all areas of science and human thought. Yet, only one direct search for extraterrestrial life has… [+9871 chars]"
,Investopedia,Terry Lane,5 Things to Know Before the Stock Market Opens - Investopedia,"U.S. stock futures are pointing higher, with shares of Robinhood and AppLovin surging on news the two companies will be joining the S&P 500. Here's what investors need to know today.",https://www.investopedia.com/5-things-to-know-before-the-stock-market-opens-september-08-2025-11805172,https://www.investopedia.com/thmb/d84_IP9NVcoPrDRvR6Go5GkM4Kk=/1500x0/filters:no_upscale():max_bytes(150000):strip_icc()/GettyImages-2222922261-b80f031fdddd4a29ac5f9df318329625.jpg,2025-09-08 11:47:54+00:00,U.S. stock futures are pointing higher as investors prepare for inflation data later this week; Robinhood Markets (HOOD) and AppLovin (APP) shares are surging on news they will be added to the S&amp;… [+3290 chars]
abc-news,ABC News,ABC News,Charlie Sheen reveals lifelong struggle that he says led him to drink - ABC News,,https://abcnews.go.com/GMA/Culture/charlie-sheen-reveals-lifelong-struggle-led-drink/story?id\\u003d125345303,,2025-09-08 11:40:47+00:00,
,Panthers.com,,Inside The Numbers: Panthers at Jaguars in Week 1 - Panthers.com,A look at the stats and snap counts from the Panthers' loss in the regular season opener at Jacksonville.,https://www.panthers.com/news/inside-the-numbers-panthers-at-jaguars-in-week-1,https://static.clubs.nfl.com/image/upload/t_editorial_landscape_12_desktop/panthers/k9mugslwfzxz6erhgb48,2025-09-08 11:39:10+00:00,
,9to5Mac,Ben Lovejoy,C1 modem planned for the iPhone 17 Air is slower on some carriers - 9to5Mac,Apple has been working for many years on developing its own mobile data modem to replace the Qualcomm ones on...,https://9to5mac.com/2025/09/08/c1-modem-planned-for-the-iphone-17-air-is-slower-on-some-carriers/,https://i0.wp.com/9to5mac.com/wp-content/uploads/sites/6/2025/03/iphone-air.jpg?resize=1200%2C628&quality=82&strip=all&ssl=1,2025-09-08 11:39:00+00:00,"Apple has been working for many years on developing its own mobile data modem to replace the Qualcomm ones on which it has traditionally relied. The first of these, the C1 chip, was used in the iPhon… [+3006 chars]"
,Electrek,Fred Lambert,Mercedes unveils GLC electric SUV: a more refined all-electric platform with 440 miles of range - Electrek,Mercedes-Benz has now fully pulled the wraps off the all-electric GLC at IAA Mobility in Munich. A new next-gen electric...,http://electrek.co/2025/09/08/mercedes-unveils-glc-electric-suv-refined-ev-platform-range/,https://i0.wp.com/electrek.co/wp-content/uploads/sites/3/2025/09/25C0225_007-e1757330345393.jpg?resize=1200%2C628&quality=82&strip=all&ssl=1,2025-09-08 11:32:00+00:00,Mercedes-Benz has now fully pulled the wraps off the all-electric GLC at IAA Mobility in Munich. A new next-gen electric powertrain now underpins the most popular model from the German luxury automot… [+3700 chars]
,Rock Paper Shotgun,Edwin Evans-Thirlwell,"Indiana Jones devs MachineGames tease another Wolfenstein game - ""we have a story to tell"" - Rock Paper Shotgun","A third Wolfenstein game from MachineGames is a possibility, according to the studio's head.",https://www.rockpapershotgun.com/indiana-jones-devs-machinegames-tease-another-wolfenstein-game-we-have-a-story-to-tell,https://assetsio.gnwcdn.com/1_iFxBw0V.png?width=1200&height=630&fit=crop&enable=upscale&auto=webp,2025-09-08 11:21:02+00:00,"In good news for those saddened by their inability to stamp on Hitler's head in Indiana Jones And The Great Circle, Machine Games are once again making noises about developing a new Wolfenstein game.… [+2990 chars]"
,The Denver Post,Parker Gabriel,The Bo Nix Growth Meter and Sean Payton’s fourth-down gamble. Parker Gabriel’s 7 thoughts on Broncos’ season-opening win. - The Denver Post,A deep dive on everything you need to know after the Broncos’ season-opening win over Tennessee.,https://www.denverpost.com/2025/09/08/broncos-titans-7-thoughts-week-1-parker-gabriel/,https://www.denverpost.com/wp-content/uploads/2025/09/TDP-L-BRONCOS-TITANSAO2_7065x.jpg?w=1024&h=700,2025-09-08 11:15:35+00:00,"Seven thoughts after Nik Bonitto and the Broncos defense saved the day in a 20-12 Week 1 win over the Tennessee Titans on Sunday at Empower Field.
1. Denvers discombobulation offensively sure looked… [+20163 chars]"
,Video Games Chronicle,Chris Scullion,"Lenovo says its $1,100 handheld will also get the Xbox mode coming to the ROG Xbox Ally - Video Games Chronicle",The Xbox 'full-screen experience' is coming to the Lenovo Legion Go Gen 2 next year,https://www.videogameschronicle.com/news/lenovo-says-its-1100-handheld-will-also-get-the-xbox-mode-coming-to-the-rog-xbox-ally/,https://www.videogameschronicle.com/files/2025/09/lenovo-legion-go-gen-2.jpg,2025-09-08 11:11:24+00:00,"Lenovo is the first company to confirm that it too will be getting the Xbox front-end coming to the ROG Xbox Ally.
The Asus ROG Xbox Ally and more powerful ROG Xbox Ally X will be released on Octobe… [+2231 chars]"
,San Francisco Chronicle,Laura Waxmann,Exclusive: Downtown S.F.’s most troubled development could see reboot as buyer emerges - San Francisco Chronicle,This unfinished San Francisco development was left as a gaping hole near Salesforce Tower. Is a skyscraper next as a new buyer emerges?,https://www.sfchronicle.com/realestate/article/sf-downtown-oceanwide-tower-21029168.php,https://s.hdnux.com/photos/01/54/36/21/28435567/5/rawImage.jpg,2025-09-08 11:09:41+00:00,"The Oceanwide Center site at 50 First St. in downtown San Francisco has been unattended for years, after financial problems halted construction of what would have been two new towers. Now, a develope… [+12467 chars]"
,SFGate,Gillian Mohney,COVID vaccine access limited: Who can still get the shot in California - SFGATE,"After major changes from the FDA, we break down who is eligible for their shots as we enter cold and flu season.",https://www.sfgate.com/bayarea/article/covid-19-flu-vaccine-explainer-21033342.php,https://s.hdnux.com/photos/01/54/36/15/28435268/3/rawImage.jpg,2025-09-08 11:09:05+00:00,"A pharmacy advertises COVID-19 testing and vaccination in Brooklyn in New York City on Sept. 4, 2025. 
Spencer Platt/Getty Images
COVID-19 rates are still climbing as September begins, riding a sum… [+7743 chars]"
ars-technica,Ars Technica,Ars Contributors,Tiny Vinyl is a new pocketable record format for the Spotify age - Ars Technica,Format is “more aligned with how artists are making and releasing music in the streaming era.”…,https://arstechnica.com/gadgets/2025/09/tiny-vinyl-is-a-new-pocketable-record-format-for-the-spotify-age/,https://cdn.arstechnica.net/wp-content/uploads/2025/09/tinyvinyl5-1152x648.jpg,2025-09-08 11:00:51+00:00,
wired,Wired,Julian Chokkattu,The iPhone 17 Air Could Use a Silicon-Carbon Battery. What Is It? - WIRED,"Phones with thinner designs are enjoying a moment. But while thin phones usually suffer poor battery life, batteries with silicon-carbon anodes are helping circumvent that notion.",https://www.wired.com/story/iphone-17-air-silicon-carbon-battery-what-is-it/,"https://media.wired.com/photos/68be8031d0c53e9be6aef646/191:100/w_1280,c_limit/GettyImages-2232716830.jpg",2025-09-08 11:00:00+00:00,"Apple has taken the second approach with caveats. Rumors suggest the iPhone 17 Air's battery capacity will sit around 2,900 mAh, a steep drop from prior iPhone models, especially at the 6.6-inch scre… [+3207 chars]"
,IFLScience,Laura Simmons,"“Truly A Reversal”: Scientists Find Protein That Causes Brain Aging, And Learn How To Stop It - IFLScience",FTL1 could be the key to slowing down aging in the hippocampus.,https://www.iflscience.com/truly-a-reversal-scientists-find-protein-that-causes-brain-aging-and-learn-how-to-stop-it-80715,https://assets.iflscience.com/assets/articleNo/80715/aImg/86271/neurons-and-glia-meta.jpg,2025-09-08 10:58:58+00:00,"A protein thats central to brain aging has been discovered by scientists, whove gone the extra mile by also finding out how it can be stopped. FTL1, as its called, is a key mediator of aging in the h… [+3430 chars]"
,Science Daily,,Scientists finally crack the mystery of rogue waves - ScienceDaily,"Once thought to be sailors’ myths, rogue waves gained credibility after a towering 80-foot wall of water struck the Draupner oil platform in 1995. New research shows that these extreme waves don’t need mysterious forces to form—they emerge when ordinary ocean…",https://www.sciencedaily.com/releases/2025/09/250907172647.htm,https://www.sciencedaily.com/images/1920/small-boat-giant-wave-tsunami.webp,2025-09-08 10:56:08+00:00,"On New Year's Day 1995, a monstrous 80-foot wave in the North Sea slammed into the Draupner oil platform. The wall of water crumpled steel railings and flung heavy equipment across the deck -- but it… [+4556 chars]"
,AppleInsider,William Gallagher,More leaked images give weight to Apple's iPhone 17 cross-body strap - AppleInsider,Yet more evidence of Apple launching a crossbody strap for the iPhone 17 has surfaced with a generally reliable leaker showing off images.,https://appleinsider.com/articles/25/09/08/more-leaked-images-give-weight-to-apples-iphone-17-cross-body-strap,https://photos5.appleinsider.com/gallery/65010-135602-000-lead-crossbody-strap-xl.jpg,2025-09-08 10:55:00+00:00,"Yet more evidence of Apple launching a crossbody strap for the iPhone 17 has surfaced with a generally reliable leaker showing off images.
The first claims of a crossbody strap for the iPhone 17 in … [+1050 chars]"
,Bengals.com,,How The Bengals Made It All Good In The Opener: 'Worship My Defense Right Now.' - Cincinnati Bengals,"Senior writer Geoff Hobson goes in-depth on how the Bengals won a gritty, defensive Week 1 matchup.",https://www.bengals.com/news/how-the-bengals-made-it-all-good-in-the-opener-worship-my-defense-right-now,https://static.clubs.nfl.com/image/upload/t_editorial_landscape_12_desktop/bengals/uksftaatwxkikgym0f95,2025-09-08 10:52:30+00:00,
,Tom's Guide,Darragh Murphy,Want to keep Windows 10? Here’s the one thing you must do before the October deadline - Tom's Guide,Don't ignore this critical free update before the October 14 end of life deadline,https://www.tomsguide.com/computing/windows-operating-systems/want-to-keep-windows-10-heres-the-one-thing-you-must-do-before-the-october-deadline,https://cdn.mos.cms.futurecdn.net/9Lsu7b4eoVLUYJ86oBhSgj.jpg,2025-09-08 10:51:17+00:00,"Follow Apple Event Live now
(Image credit: MacRumors/Getty/Apple)
Apple is about to launch the new iPhone 17. Follow our Apple Event live blog right now!
The end of Windows 10 is coming, as Micros… [+4546 chars]"
,Skyatnightmagazine.com,Iain Todd,Brand new image of interstellar comet 3I/ATLAS shows it's becoming more active and getting longer as it approaches the Sun - BBC Sky at Night Magazine,Comet 3I/ATLAS images by Gemini South telescope show its tail is growing and it's becoming more active as it moves through the Solar System.,https://www.skyatnightmagazine.com/news/3i-atlas-gemini-south,https://c02.purpledshub.com/uploads/sites/48/2025/09/3i-atlas-gemini-south-social.jpg?w=1200,2025-09-08 10:33:48+00:00,"A new image of the interstellar comet 3I/ATLAS shows it's becoming more active and its tail is getting longer as it makes its way through our inner Solar System.
The image was captured by both astro… [+5881 chars]"
,Detroit Free Press,Dave Birkett,Detroit Lions slapped by reality in 27-13 egg vs Green Bay Packers in Week 1 - Detroit Free Press,Detroit Lions were dominated in a 27-13 loss to their NFC North rival Green Bay Packers on Sunday at Lambeau Field in Week 1. Here are key takeaways.,https://www.freep.com/story/sports/nfl/lions/2025/09/07/lions-packers-game-score-nfl-week-1/86027256007/,"https://www.freep.com/gcdn/authoring/authoring-images/2025/09/07/PDTF/86032668007-090725-lions-1-h-049.jpg?crop=3315,1865,x0,y0&width=3200&height=1801&format=pjpg&auto=webp",2025-09-08 10:29:16+00:00,
cbs-news,CBS News,,"Harrowing details emerge after surfer killed by shark off popular beach in Australia: ""Really dramatic"" - CBS News","The surfer, who had a wife and young daughter, lost ""a number of limbs"" and his surfboard was broken in two, police said.",https://www.cbsnews.com/news/shark-attack-details-surfer-killed-australia-mercury-psillakis/,https://assets1.cbsnewsstatic.com/hub/i/r/2025/09/08/2d929f75-a51c-49ec-bf96-9e5b6722e372/thumbnail/1200x630/827d709892be0fad75d43442a7491538/gettyimages-2233287124.jpg,2025-09-08 10:26:00+00:00,"Australian biologists said Sunday a great white shark measuring up to 12 feet likely killed a 57-year-old surfer off Sydney this weekend, as harrowing details of the attack emerged and authorities st… [+3544 chars]"
,Android Authority,,NotebookLM isn't just for students. Here are 4 ways I use it in my daily life - Android Authority,These niche uses for my personal tasks and projects have proven what a powerful tool NotebookLM can be for ordinary people.,https://www.androidauthority.com/using-notebooklm-in-daily-life-3592773/,https://www.androidauthority.com/wp-content/uploads/2025/05/google-notebooklm-android-app-1.jpg,2025-09-08 09:45:56+00:00,"I consider myself a generative AI skeptic, with my initial interest in the technology turning into frustration and distrust. But theres one tool that has genuinely impressed me over the past few mont… [+6814 chars]"
,NPR,,Food-makers are phasing out artificial dyes. The problem: Americans love the color - NPR,"Sam's Club is among the food makers removing artificial dyes from products, yet hoping shoppers don't notice a difference in color. But why?",https://www.npr.org/2025/09/08/nx-s1-5529276/sams-club-food-dye-taste-history,https://npr.brightspotcdn.com/dims3/default/strip/false/crop/3000x1688+0+228/resize/1400/quality/100/format/jpeg/?url=http%3A%2F%2Fnpr-brightspot.s3.amazonaws.com%2F9c%2Ffe%2Fabb9428a49ae9e00e831059e59dd%2F070725-red-dye-177.jpg,2025-09-08 09:00:00+00:00,"Cupcake icing and sports drinks in all their crayon-like colors are the final frontiers for Nick Scheidler's team.
Scheidler leads product development at Walmart's Sam's Club, which in 2022 committe… [+5550 chars]"
,GameSpot,Blair Marnell,Octopath Traveler 0 Will Limit The Size Of Your City Based On Your Console - GameSpot,"If you want a big city in Octopath Traveler 0, then there's one system you're going to want to avoid.",https://www.gamespot.com/articles/octopath-traveler-0-will-limit-the-size-of-your-city-based-on-your-console/1100-6534529/,https://www.gamespot.com/a/uploads/screen_kubrick/1837/18375603/4563144-octopathtraveler0.jpg,2025-09-08 08:51:18+00:00,"Later this year, Octopath Traveler 0 will put you in control of your own destiny as you attempt to rebuild your town alongside a party of heroes. But the size of your city is going to be limited base… [+1406 chars]"
,GameSpot,Blair Marnell,New Starfield Expansion Potentially Teased In Coded Message - GameSpot,The two-year anniversary for Starfield sure looks like it's setting the stage for something new.,https://www.gamespot.com/articles/new-starfield-expansion-potentially-teased-in-coded-message/1100-6534528/,https://www.gamespot.com/a/uploads/screen_kubrick/1837/18375603/4563131-starfield.jpg,2025-09-08 08:49:05+00:00,"Two years ago this week, Bethesda's interstellar action-RPG Starfield debuted on Xbox Series X|S and PC. The first major expansion, Shattered Space, was released in September 2024. Now, a new expansi… [+1331 chars]"
,Video Games Chronicle,Chris Scullion,Nintendo wins $2 Million settlement against Switch modchip seller who previously denied wrongdoing - Video Games Chronicle,Ryan Daly is also permanently banned from handling modded hardware again,https://www.videogameschronicle.com/news/nintendo-wins-2-million-settlement-against-switch-modchip-seller-who-previously-denied-wrongdoing/,https://www.videogameschronicle.com/files/2021/07/oled-model-photo-03.jpg,2025-09-08 08:44:27+00:00,"A Switch modchip seller who was sued by Nintendo last year but denied any wrongdoing has settled with the company and agreed to pay $2 million.
Nintendo filed a complaint in July 2024 against Michig… [+2215 chars]"
,Tipranks.com,Sheryl Sheth,Tesla Stock (TSLA) Draws Mixed Ratings After Musk’s $1 Trillion Package - TipRanks,"Electric vehicle maker Tesla’s ($TSLA) board has proposed a humongous $1 trillion compensation package for its CEO, Elon Musk, if he meets extremely ambitious targe...",https://www.tipranks.com/news/tesla-stock-tsla-draws-mixed-ratings-after-musks-1-trillion-package,https://blog.tipranks.com/wp-content/uploads/2025/09/shutterstock_2150468721-750x406.jpg,2025-09-08 07:57:40+00:00,"Story HighlightsMusks $1 trillion pay package has drawn Wall Streets attention, with analysts saying it is the best way to keep him motivated to deliver on Teslas massive growth targets."
,NBCSports.com,Vaughn Dalzell,"2025 College Football Rankings Week 3 Top 25: New Top 5! Oklahoma stock up, Florida, Clemson, SMU, ASU down - NBC Sports",Vaughn Dalzell shares his College Football Top 25 Week 3 Poll following Week 2's wild action!,https://www.nbcsports.com/college-football/news/2025-college-football-rankings-week-3-top-25-new-top-5-oklahoma-stock-up-florida-clemson-smu-asu-down,https://nbcsports.brightspotcdn.com/dims4/default/e996cb5/2147483647/strip/true/crop/6000x3375+0+312/resize/1440x810!/quality/90/?url=https%3A%2F%2Fnbc-sports-production-nbc-sports.s3.us-east-1.amazonaws.com%2Fbrightspot%2F39%2Fdf%2F18ec86a74347b2d4476497c536e8%2Fhttps-delivery-gettyimages.com%2Fdownloads%2F2234080323,2025-09-08 07:55:05+00:00,"Points, points, points! That was the theme of Week 2 as we saw Florida State (77), Tennessee (72), Ohio State (70), Oregon (69), Nebraska (68), Utah (63), and Texas Tech (62) all score more than 60 t… [+20513 chars]"
,Science Daily,,Autism symptoms vanish in mice after Stanford brain breakthrough - ScienceDaily,"Scientists at Stanford have found that hyperactivity in the brain’s reticular thalamic nucleus may drive autism-like behaviors. In mouse models, drugs and neuromodulation techniques that suppressed this overactive region reversed symptoms, hinting at new ther…",https://www.sciencedaily.com/releases/2025/09/250907172644.htm,https://www.sciencedaily.com/images/1920/autism-spectrum-disorder-hands-holding-brain-puzzle.webp,2025-09-08 07:49:03+00:00,Stanford Medicine scientists investigating the neurological underpinnings of autism spectrum disorder have found that hyperactivity in a specific brain region could drive behaviors commonly associate… [+2506 chars]
,Neowin,Sayan Sen,"Phison confirms potential real reason for ""Windows 11 SSD killing and corruption"" bug - Neowin",It looks like the actual cause of the SSD failure issues that were blamed on Microsoft&#039;s Windows 11 24H2 has been confirmed by Phison.,https://www.neowin.net/news/phison-confirms-potential-real-reason-for-windows-11-ssd-killing-and-corruption-bug/,https://cdn.neowin.com/news/images/uploaded/2025/09/1757316545_windows_11_24h2_red_neowin_story.webp,2025-09-08 07:40:00+00:00,"Earlier this weekend we covered what could be the actual cause of the SSD failures that were seemingly hit by the August 2025 Patch Tuesday update. The new report, thanks to the efforts of a PC DIY e… [+1423 chars]"
,ScienceAlert,The Conversation,"No, Your Cravings Aren't a Reliable Sign of Cancer, Expert Explains - ScienceAlert","Why do health stories about food and cancer grab so much attention? Because they offer an enticing promise: that a single item on your plate, or even a sudden change in what you crave, might hold the key to spotting disease early.",https://www.sciencealert.com/no-your-cravings-arent-a-reliable-sign-of-cancer-expert-explains,https://www.sciencealert.com/images/2025/09/cancer_food_craving_header.jpg,2025-09-08 07:18:45+00:00,"Why do health stories about food and cancer grab so much attention? Because they offer an enticing promise: that a single item on your plate, or even a sudden change in what you crave, might hold the… [+5965 chars]"
,CNBC,Yeo Boon Ping,CNBC Daily Open: U.S. jobs report in August reveals damage the Fed should mend - CNBC,"If the Fed cuts rates later this month — a move it'll almost certainly make — it'll be a stitch, just in time, to save investors more than a dime.",https://www.cnbc.com/2025/09/08/cnbc-daily-open-us-jobs-report-in-august-reveals-damage-the-fed-should-mend.html,https://image.cnbcfm.com/api/v1/image/108195351-1757309407276-gettyimages-2233901120-anotherday111707875_x3fai1th.jpeg?v=1757309434&w=1920&h=1080,2025-09-08 06:30:01+00:00,At this moment in the U.S. economy when interest rates are higher than usual and inflation still above the Federal Reserve's 2% target the jobs report is rather like an injury. You want it bad enough… [+3166 chars]
