source_id,source_name,author,title,description,url,urlToImage,publishedAt,content
,TMZ,,'Breaking Bad' Star Raymond Cruz Arrested For Spraying a Neighbor with Hose - TMZ,,https://www.tmz.com/2025/09/08/breaking-bad-raymond-cruz-arrested-for-alleged-battery/,,2025-09-08 20:21:59+00:00,Description: Group Number: Group Name: Ip Address: Username: Computer Name:
,BaltimoreRavens.com,,Ravens Grades & Snap Counts vs. Bills - Baltimore Ravens,Chidobe Awuzie played the No. 3 cornerback while rookie Teddye Buchanan took more snaps than Trenton Simpson.,https://www.baltimoreravens.com/news/ravens-grades-snap-counts-buffalo-bills,https://static.clubs.nfl.com/image/upload/t_editorial_landscape_12_desktop/ravens/ryw26sxpudf2ey3gx18f,2025-09-08 20:03:45+00:00,
espn,ESPN,Stephen Holder,Ex-Fins CB says Colts forced Tua into 'panic mode' - ESPN,"Former Dolphins and current Colts corner Xavien Howard said the game plan Sunday was to take away QB Tua Tagovailoa's first read and get him into ""panic mode.""",https://www.espn.com/nfl/story/_/id/46199974/xavien-howard-says-colts-forced-tagovailoa-panic-mode,https://a1.espncdn.com/combiner/i?img=%2Fphoto%2F2025%2F0908%2Fr1542851_1024x576_16%2D9.jpg,2025-09-08 19:44:00+00:00,INDIANAPOLIS -- Former Miami Dolphins star and current Indianapolis Colts cornerback Xavien Howard on Monday offered a stinging assessment of Dolphins quarterback Tua Tagovailoa in the wake of Sunday… [+2517 chars]
abc-news,ABC News,ABC News,"GOP-led House Oversight Committee receives Epstein estate documents, 'birthday book' - ABC News",,https://abcnews.go.com/Politics/gop-led-house-oversight-committee-expected-receive-epstein/story?id\\u003d125365100,,2025-09-08 19:41:15+00:00,
the-verge,The Verge,Elissa Welle,Gemini app finally expands to audio files - The Verge,"The new languages available on Search are Hindi, Indonesian, Japanese, Korean, and Brazilian Portuguese.",https://www.theverge.com/ai-artificial-intelligence/774008/gemini-audio-new-languages-notebooklm-reports,https://platform.theverge.com/wp-content/uploads/sites/2/2025/02/STK255_Google_Gemini_C.jpg?quality=90&strip=all&crop=0%2C10.732984293194%2C100%2C78.534031413613&w=1200,2025-09-08 19:14:28+00:00,"<ul><li></li><li></li><li></li></ul>
Also, Search can now accept five new languages and NotebookLM can create reports in various tones or styles. 
Also, Search can now accept five new languages and… [+3169 chars]"
ign,IGN,IGN,"Woot Has Big Deals on 2025 Gaming Releases, Including Monster Hunter Wilds for Under $30 - IGN",,https://www.ign.com/articles/woot-has-big-deals-on-2025-gaming-releases-including-monster-hunter-wilds-for-under-30,,2025-09-08 19:02:06+00:00,
,9to5Mac,Michael Burkhardt,Review: Anker’s new MagSafe battery bank truly delivers in its ultra-slim package - 9to5Mac,"Earlier this summer, Anker announced a trio of new products – one of them being an incredibly thin MagSafe/Qi2 battery...",https://9to5mac.com/2025/09/08/review-ankers-new-magsafe-battery-bank-truly-delivers-in-its-ultra-slim-package/,https://i0.wp.com/9to5mac.com/wp-content/uploads/sites/6/2025/09/Anker-Nano-Battery-FI.jpg?resize=1200%2C628&quality=82&strip=all&ssl=1,2025-09-08 18:57:00+00:00,"Earlier this summer, Anker announced a trio of new products – one of them being an incredibly thin MagSafe/Qi2 battery for iPhones, and now even Google Pixel 10. I’ve spent my fair share of time with… [+3039 chars]"
,TMZ,TMZ Staff,Kevin Costner Stuntwoman Claims She Was Menstruating During Alleged Unscripted Rape Scene - TMZ,"12:38 PM PT -- Costner's attorney Marty Singer is firing back, telling us ... “This may be a new filing, but it’s really just more of the same old nonsense. These claims are not only groundless, they are ridiculous. There are 12 independent witnesses who conf…",https://www.tmz.com/2025/09/08/kevin-costner-horizon-2-stuntwoman-claims-menstruating-during-unscripted-rape-scene/,https://imagez.tmz.com/image/42/16by9/2025/09/08/42dc5a305ddd4d1fadfd7edf75bf35d7_xl.jpg,2025-09-08 18:51:15+00:00,"12:38 PM PT -- Costner's attorney Marty Singer is firing back, telling us ... This may be a new filing, but its really just more of the same old nonsense. These claims are not only groundless, they a… [+2206 chars]"
politico,Politico,"Josh Gerstein, Kyle Cheney",Supreme Court lifts restrictions on ‘roving’ ICE raids in Los Angeles - Politico,The ruling blocks a lower court’s order that found the enforcement operations were based on impermissible factors.,https://www.politico.com/news/2025/09/08/supreme-court-ice-raids-ruling-00550551,https://www.politico.com/dims4/default/resize/1200/quality/90/format/jpg?url=https%3A%2F%2Fstatic.politico.com%2F8c%2Fee%2F4301726e4a2881f9a20919345308%2Fimmigration-raids-los-angeles-82959.jpg,2025-09-08 18:41:04+00:00,"The courts three liberal justices dissented.
We should not have to live in a country where the Government can seize anyone who looks Latino, speaks Spanish, and appears to work a low wage job, Justi… [+2410 chars]"
,Yahoo Entertainment,Ananya Gairola,Apple's Upcoming 'Awe Dropping' Event With iPhone 17 Air Draws Criticism As Commentator Daniel Newman Slams 'Lack Of Innovation' - Yahoo Finance,"As Apple Inc. (NASDAQ:AAPL) gears up for its highly anticipated iPhone 17 launch, industry analyst Daniel Newman has criticized the company for relying on...",https://finance.yahoo.com/news/apples-upcoming-awe-dropping-event-183059932.html,https://media.zenfs.com/en/benzinga_79/5b54b10f0d18e8439e1952d6ca16cdab,2025-09-08 18:30:59+00:00,"Benzinga and Yahoo Finance LLC may earn commission or revenue on some items through the links below.
As Apple Inc. (NASDAQ:AAPL) gears up for its highly anticipated iPhone 17 launch, industry analys… [+6000 chars]"
,NPR,Rachel Treisman,"Highlights from the VMAs, from Mariah Carey's first win to Lady Gaga's magic act - NPR",Sunday's VMAs were the first time the awards show has been broadcast on CBS in addition to MTV. The show recognized rising stars and longtime icons alike.,https://www.npr.org/2025/09/08/nx-s1-5534149/mtv-vma-winners-takeaways-lady-gaga-ozzy-osbourne-mariah-carey,https://npr.brightspotcdn.com/dims3/default/strip/false/crop/2999x1687+0+0/resize/1400/quality/100/format/png/?url=http%3A%2F%2Fnpr-brightspot.s3.amazonaws.com%2F4c%2F6e%2F6b80913b4e4785512be4df4f9505%2Fvma25-trio.png,2025-09-08 18:22:20+00:00,"Some of the biggest names in music assembled in New York Sunday night for the time-honored tradition of the MTV Video Music Awards, only this time on an even bigger stage.
In addition to the cable c… [+8462 chars]"
,NBCSports.com,Myles Simmons,"Andy Reid on Xavier Worthy’s shoulder: He’s rehabbing, it’s day-by-day here - NBC Sports",Chiefs receiver Xavier Worthy suffered a shoulder injury during the team’s Week 1 loss to the Chargers on Friday.,https://www.nbcsports.com/nfl/profootballtalk/rumor-mill/news/andy-reid-on-xavier-worthys-shoulder-hes-rehabbing-its-day-by-day-here,https://nbcsports.brightspotcdn.com/dims4/default/5ca9b57/2147483647/strip/true/crop/4332x2437+0+0/resize/1440x810!/quality/90/?url=https%3A%2F%2Fnbc-sports-production-nbc-sports.s3.us-east-1.amazonaws.com%2Fbrightspot%2Fb2%2F69%2F280ecc644356a8ff8933e944b792%2Fhttps-delivery-gettyimages.com%2Fdownloads%2F2229995640,2025-09-08 18:19:54+00:00,"Chiefs receiver Xavier Worthy suffered a shoulder injury during the teams Week 1 loss to the Chargers on Friday.
As of now, its unclear when Worthy might be available again.
So, as far as the injur… [+982 chars]"
,TVLine,Ryan Schwartz,'Leanne' Renewed for Season 2 at Netflix — Leanne Morgan Comedy Series - TVLine,"Leanne Morgan's self-titled Netflix sitcom has been renewed for Season 2, TVLine has learned.",https://tvline.com/news/leanne-season-2-renewed-netflix-1235504094/,https://tvline.com/wp-content/uploads/2025/09/leanne-season-2-renewed-netflix.jpg?w=650,2025-09-08 18:00:00+00:00,"Leanne Morgan’s self-titled Netflix sitcom has been renewed for Season 2, TVLine has learned. 
The pickup comes roughly five weeks after the launch of Leanne’s freshman run, which consisted of 16 ep… [+1580 chars]"
,WCVB Boston,Phil Tenser,"Hasbro leaving Pawtucket for Boston, bringing 700 jobs to Seaport - WCVB","Hasbro, the century-old company behind childhood favorites like Monopoly and Play-Doh, is moving to Boston.",https://www.wcvb.com/article/hasbro-boston-pawtucket-moving-massachusetts-rhode-island/66015168,"https://kubrick.htvapps.com/htv-prod-media.s3.amazonaws.com/images/hasbro-seaport-home-68bf3c7f4495c.jpg?crop=1.00xw:1.00xh;0,0&resize=1200:*",2025-09-08 18:00:00+00:00,"BOSTON —Hasbro, the century-old company behind childhood favorites like Monopoly and Play-Doh, is leaving Rhode Island and moving to Boston.
The company announced plans Monday to relocate its Pawtuc… [+1621 chars]"
,NBCSports.com,Josh Alper,Kendrick Bourne to sign with 49ers - NBC Sports,49ers head coach Kyle Shanahan said after Sunday's win over the Seahawks that the team hoped to get a deal done with free agent wide receiver Kendrick Bourne after visiting with him last week and things have now fallen into place.,https://www.nbcsports.com/nfl/profootballtalk/rumor-mill/news/kendrick-bourne-to-sign-with-49ers,https://nbcsports.brightspotcdn.com/dims4/default/c96b26b/2147483647/strip/true/crop/6000x3375+0+0/resize/1440x810!/quality/90/?url=https%3A%2F%2Fnbc-sports-production-nbc-sports.s3.us-east-1.amazonaws.com%2Fbrightspot%2F81%2F0e%2F1031ac7c4c37b6a6ab197bf812ab%2Fhttps-delivery-gettyimages.com%2Fdownloads%2F2184951945,2025-09-08 17:59:58+00:00,49ers head coach Kyle Shanahan said after Sundays win over the Seahawks that the team hoped to get a deal done with free agent wide receiver Kendrick Bourne after visiting with him last week and thin… [+778 chars]
,BBC News,,Fatal stabbing of Ukrainian refugee in North Carolina ignites crime debate - BBC,Commentators are criticising the judicial system after a graphic video showing the killing of Iryna Zarutska on a train in Charlotte was released.,https://www.bbc.com/news/articles/cgknxyl77x6o,https://ichef.bbci.co.uk/news/1024/branded_news/b913/live/74bd0c60-8cd3-11f0-9cf6-cbf3e73ce2b9.jpg,2025-09-08 17:59:03+00:00,"The murder of 23-year old Ukrainian refugee Iryna Zarutska on a train in North Carolina last month has sparked ongoing concerns about crime in the US. 
A video publicised on Friday by the Charlotte … [+3391 chars]"
abc-news,ABC News,ABC News,Father and son speak out after viral Phillies-Marlins game confrontation - ABC News,,https://abcnews.go.com/GMA/Living/father-son-speak-after-viral-phillies-marlins-game/story?id\\u003d125366422,,2025-09-08 17:54:44+00:00,
,NBCSports.com,Myles Simmons,Brian Daboll: Russell Wilson will start Week 2 - NBC Sports,The Giants aren't turning to their rookie QB Jaxson Dart just yet.,https://www.nbcsports.com/nfl/profootballtalk/rumor-mill/news/brian-daboll-russell-wilson-will-start-week-2,https://nbcsports.brightspotcdn.com/dims4/default/79419e4/2147483647/strip/true/crop/4831x2717+0+0/resize/1440x810!/quality/90/?url=https%3A%2F%2Fnbc-sports-production-nbc-sports.s3.us-east-1.amazonaws.com%2Fbrightspot%2F24%2F5f%2Fc810511c484baacbab7f197b22bd%2Fhttps-api-imagn.com%2Frest%2Fdownload%2FimageID%3D26474010,2025-09-08 17:50:33+00:00,"At some point, the Giants will turn to their rookie quarterback, Jaxson Dart. 
But that will not be in Week 2. 
New York head coach Brian Daboll told reporters on Monday that Russell Wilson will be… [+1111 chars]"
the-verge,The Verge,Jay Peters,Nova Launcher’s founder and sole developer has left - The Verge,"Kevin Barry, the founder and only developer of the Nova Launcher for Android, has left after being told to stop work on the launcher and open sourcing it.",https://www.theverge.com/news/773937/nova-launcher-founder-left-kevin-barry-branch-open-source-android,https://platform.theverge.com/wp-content/uploads/sites/2/2025/09/Screenshot_2024_08_09_at_5.17.19_PM.png.webp?quality=90&strip=all&crop=0%2C10.642922330563%2C100%2C78.714155338873&w=1200,2025-09-08 17:45:53+00:00,"<ul><li></li><li></li><li></li></ul>
Kevin Barry had been working on open sourcing the launcher, but said he was told to stop work on that project.
Kevin Barry had been working on open sourcing the… [+3059 chars]"
,Kotaku,Zack Zwiezen,Best Buy's Big PS5/Xbox Video Game Clearance Sale Is Live Now - Kotaku,"Physical copies of Tiny Tina's Wonderlands, Deatloop, Midnight Suns, Diablo IV, Neon White, and more are cheap right now",https://kotaku.com/best-buys-video-game-clearance-sale-includes-some-good-deals-on-big-games-2000624096,https://kotaku.com/app/uploads/2025/09/New-Project-2-1200x675.jpg,2025-09-08 17:41:18+00:00,"Best Buy is liquidating its warehouse with a big clearance sale on an oddball assortment of Xbox, PlayStation, and Switch physical games. However, to find deals worth potentially grabbing, you’ll hav… [+2209 chars]"
ars-technica,Ars Technica,Jennifer Ouellette,Benoit Blanc goes full Gothic in Wake Up Dead Man trailer - Ars Technica,"“To understand this case, we need to look around the myth that’s being constructed.”…",https://arstechnica.com/culture/2025/09/wake-up-dead-man-trailer-teases-classic-locked-room-puzzle/,https://cdn.arstechnica.net/wp-content/uploads/2025/09/deadmanTOP-1152x648-1757345650.jpg,2025-09-08 17:40:21+00:00,
nbc-news,NBC News,Lawrence Hurley,Supreme Court allows Trump to fire FTC commissioner - NBC News,The Supreme Court on Monday allowed President Donald Trump to fire a member of the Federal Trade Commission despite a federal law that is intended to restrict the White House’s power to control the agency.,https://www.nbcnews.com/politics/supreme-court/supreme-court-allows-trump-fire-ftc-commissioner-rcna229385,"https://media-cldnry.s-nbcnews.com/image/upload/t_nbcnews-fp-1200-630,f_auto,q_auto:best/rockcms/2025-09/250904-Rebecca-Kelly-Slaughter-vl-412p-c67113.jpg",2025-09-08 17:39:20+00:00,WASHINGTON The Supreme Court on Monday allowed President Donald Trump to fire a member of the Federal Trade Commission despite a federal law that is intended to restrict the White Houses power to con… [+2688 chars]
cbs-news,CBS News,Emily Mae  Czachor,Auburn professor stabbed to death while walking her dog in Alabama park; man charged with murder - CBS News,"A retired Auburn University professor was stabbed to death in a public park near the school in Alabama on Saturday, according to police and the university.",https://www.cbsnews.com/news/auburn-professor-stabbed-death-walking-dog-man-charge-murder/,https://assets1.cbsnewsstatic.com/hub/i/r/2025/09/08/e6d0e4eb-07ce-4df6-bd73-dccd77e96aee/thumbnail/1200x630/475147c2ad380dbe41795c54d758cb76/schnuelle.png,2025-09-08 17:33:00+00:00,"A retired professor at Auburn University was stabbed to death over the weekend in a park near the Alabama college campus, according to Auburn Police and the university. A man has been arrested and ch… [+2892 chars]"
,Pittsburgh Post-Gazette,Gerry Dulac,"Gerry Dulac: It was only Week 1, but don't let that discount Aaron Rodgers' near-perfect Steelers debut - Pittsburgh Post-Gazette",False,https://www.post-gazette.com/sports/steelers/2025/09/08/gerry-dulac-steelers-jets-week-1-breakdown-aaron-rodgers-nfl/stories/202509040150,https://f50d772ec1e2a4347264-964b3324d77f313a724faa237152e95f.ssl.cf2.rackcdn.com/stories/202509040150/1140x_a10-7_cTC/2234186751_1757346412.jpg,2025-09-08 17:31:27+00:00,MENU
,Financial Times,Andres Schipani,Nepal police open fire on ‘Gen Z’ protests sparked by social media block - Financial Times,At least 19 reportedly killed while demonstrating against ban on platforms including Facebook and Instagram,https://www.ft.com/content/f8fa4b1f-d513-4163-a474-506ada60960f,https://images.ft.com/v3/image/raw/https%3A%2F%2Fd1e00ek4ebabms.cloudfront.net%2Fproduction%2F2f4ae972-ee38-44b6-a1fe-da2956f16217.jpg?source=next-barrier-page,2025-09-08 17:29:34+00:00,"Complete digital access to quality analysis and expert insights, complemented with our award-winning Weekend Print edition.
<ul><li></li>Everything in Print<li></li>Weekday Print Edition<li></li>FT … [+231 chars]"
techcrunch,TechCrunch,Amanda Silberling,"Meta suppressed children’s safety research, four whistleblowers claim - TechCrunch",Four whistleblowers share documents with Congress alleging that the company may have suppressed research on children's safety.,https://techcrunch.com/2025/09/08/meta-suppressed-childrens-safety-research-four-whistleblowers-claim/,https://techcrunch.com/wp-content/uploads/2025/07/GettyImages-2194278734.jpg?w=1024,2025-09-08 17:29:08+00:00,"Two current and two former Meta employees disclosed documents to Congress alleging that the company may have suppressed research on children’s safety, according to a report from The Washington Post.… [+2977 chars]"
the-verge,The Verge,"Andrew Liszewski, Jess Weatherbed",The best stuff announced at IFA - The Verge,"A ball-catching robot tennis coach, cuddly AI robots, and a laptop with a rotating screen for optimal doomscrolling.",https://www.theverge.com/news/769573/ifa-2025-smart-home-lights-power-bank-robot-vacuum-ai-headphones,https://platform.theverge.com/wp-content/uploads/sites/2/2025/09/257842_Lenovo_ThinkBook_VertiFlex_Concept_IFA2025_ADiBenedetto_0012.jpg?quality=90&strip=all&crop=0%2C10.732984293194%2C100%2C78.534031413613&w=1200,2025-09-08 17:14:01+00:00,"<ul><li></li><li></li><li></li></ul>
A ball-catching robot tennis coach, cuddly AI robots, and a laptop with a rotating screen for optimal doomscrolling.
If you buy something from a Verge link, Vox… [+11233 chars]"
,Dhs.gov,,ICE Launches Operation Midway Blitz in Honor of Katie Abraham to Target Criminal Illegal Aliens Terrorizing Americans in Sanctuary Illinois - Homeland Security (.gov),The Department of Homeland Security announced Operation Midway Blitz in honor of Katie Abraham who was killed in a drunk driving hit-and-run car wreck caused by criminal illegal alien Julio Cucul-Bol in Illinois. This ICE operation will target the criminal il…,https://www.dhs.gov/news/2025/09/08/ice-launches-operation-midway-blitz-honor-katie-abraham-target-criminal-illegal,https://www.dhs.gov/sites/default/files/2024-02/24_0206_opa_og-image-dhs.jpg,2025-09-08 17:12:18+00:00,"Thanks to Governor Pritzkers sanctuary policies, TdA gang members, rapists, kidnappers, and drug traffickers are being released onto Chicagos streets
CHICAGO Today, the Department of Homeland Securi… [+4523 chars]"
,New York Post,Jenna Lemoncelli,Carlos Alcaraz parties with models after US Open triumph - New York Post,Spanish star Carlos Alcaraz partied with a slew of celebrities and models after his U.S. Open victory.,https://nypost.com/2025/09/08/sports/carlos-alcaraz-parties-with-models-after-us-open-triumph/,https://nypost.com/wp-content/uploads/sites/2/2025/09/newspress-collage-dukr9dcvn-1757349978432.jpg?quality=75&strip=all&1757335615&w=1024,2025-09-08 17:09:00+00:00,"Spanish star Carlos Alcaraz partied with a slew of celebrities and models after his U.S. Open victory over Italy’s Jannik Sinner in New York on Sunday night.
Alcaraz, who was recently linked to Brit… [+3147 chars]"
politico,Politico,Cheyanne M. Daniels,Trump says he’ll direct Education Department to protect praying in public school - Politico,"Trump reiterated plans to protect religious freedom in schools, a promise he made throughout the 2024 campaign.",https://www.politico.com/news/2025/09/08/trump-says-hell-direct-education-department-to-protect-praying-in-public-school-00550550,https://www.politico.com/dims4/default/resize/1200/quality/90/format/jpg?url=https%3A%2F%2Fstatic.politico.com%2F1c%2F30%2Fc381ccab49f59bda8d627e1d121e%2Ftrump-50953.jpg,2025-09-08 17:04:10+00:00,"Trump did not detail what the new guidance will include, but during the 2024 campaign he promised to bring back prayer to public schools.
In a statement to POLITICO, Savannah Newhouse, press secreta… [+1112 chars]"
,MarketWatch,Aarthi Swaminathan,"Mortgage rates dive on reports of worsening economy, spurring refinance queries - MarketWatch",One housing economist says the 30-year mortgage rate will drop below 6% if next month’s jobs report is also negative,https://www.marketwatch.com/story/mortgage-rates-dive-on-reports-of-worsening-u-s-economy-we-are-seeing-a-lot-of-interest-in-refinances-9c09d501,https://images.mktw.net/im-06544697/social,2025-09-08 17:01:00+00:00,"Mortgage rates are taking a deep dive as financial markets try to make sense of reports of a worsening labor market in America.
The average rate on a 30-year mortgage fell to the lowest level in nea… [+230 chars]"
associated-press,Associated Press,Ken Sweet,"PNC to buy FirstBank for $4.1B, expanding to Arizona, Colorado - AP News","PNC Financial plans to buy Colorado-based FirstBank for $4.1 billion. The acquisition gives PNC a substantial presence in the Colorado banking market and Arizona. FirstBank, typically branded as 1stBank, is a midsized bank with 120 retail branches and roughly…",https://apnews.com/article/pnc-firstbank-arizona-colorado-bank-merger-6fd63cc0be72571e05e9a93d0799ea5f,https://dims.apnews.com/dims4/default/5e361aa/2147483647/strip/true/crop/5890x3313+0+308/resize/1440x810!/quality/90/?url=https%3A%2F%2Fassets.apnews.com%2F25%2F8f%2F0074838875db2fbc520799c930a0%2F5f811627b9fc42f1a736324f4d64f9fa,2025-09-08 17:01:00+00:00,"NEW YORK (AP) PNC Financial said Monday that it plans to buy Colorado-based FirstBank for $4.1 billion, giving PNC a substantial presence in the Colorado banking market as well as Arizona. 
Based in… [+2274 chars]"
ign,IGN,Chris Reed,LEGO SEGA Genesis Controller Is Now Available – But Only as a Gift With Purchase - IGN,"This new retro gaming LEGO set can only be gotten by spending $130 or more at LEGO Store, for a limited time.",https://www.ign.com/articles/lego-sega-genesis-controller-where-to-buy,https://assets-prd.ignimgs.com/2025/09/08/11-copy-1757348445382.png?width=1280&format=jpg&auto=webp&quality=80,2025-09-08 17:00:44+00:00,I have some good news and some bad news for retro gamers. The good news is that LEGO has released an awesome set that re-creates the classic SEGA Genesis controller (see it at LEGO Store). It even ho… [+2960 chars]
,Medium,Avi Loeb,How to Distinguish a Population of Interstellar Rocks from a Fleet of Spacecraft? - Avi Loeb – Medium,How can we distinguish between the population statistics of interstellar rocks and a fleet of spacecraft that target that inner Solar…,https://avi-loeb.medium.com/how-to-distinguish-a-population-of-interstellar-rocks-from-a-fleet-of-spacecraft-2e60548d8c48,https://miro.medium.com/v2/resize:fit:615/1*QfGrAEQgUwbqJSW6uePtbw.jpeg,2025-09-08 17:00:10+00:00,"(Credit: shutterstock)
How can we distinguish between the population statistics of interstellar rocks and a fleet of spacecraft that target that inner Solar system?
The answer is obvious: by the sp… [+6419 chars]"
cnn,CNN,Saskya Vandoorne,French government collapses after prime minister loses confidence vote - CNN,"French lawmakers voted to oust Prime Minister François Bayrou Monday, plunging the country into a new political crisis and leaving it without a government at a time of increasing economic strain and geopolitical tensions.",https://www.cnn.com/2025/09/08/europe/french-prime-minister-confidence-vote-latam-intl,"https://media.cnn.com/api/v1/images/stellar/prod/2025-09-08t131756z-1715629436-rc2pnga4o8x4-rtrmadp-3-france-politics.JPG?c=16x9&q=w_800,c_fill",2025-09-08 17:00:00+00:00,"French lawmakers voted to oust Prime Minister François Bayrou Monday, plunging the country into a new political crisis and leaving it without a government at a time of increasing economic strain and … [+4291 chars]"
cnn,CNN,Chris Isidore,US Steel is shutting down a mill in Illinois. Its deal with Trump won’t let it fire its 800 workers - for now - CNN,"US Steel will stop producing steel at its Granite City, Illinois, mill, but the 900 workers workers at the plant will stay on the job due to an agreement the company reached with the Trump administration.",https://www.cnn.com/2025/09/08/business/us-steel-mill-closing-no-layoffs-under-trump-deal,"https://media.cnn.com/api/v1/images/stellar/prod/ap18193559695600.jpg?c=16x9&q=w_800,c_fill",2025-09-08 16:54:00+00:00,"US Steel is shuttering production at a mill in November, but its hundreds of workers will keep their jobs for now thanks to an agreement the company reached with the Trump administration.
US Steel w… [+2636 chars]"
,On3.com,Nick Kosko,"Billy Napier confirms he will remain play caller, has not considered giving up duties - On3",.,https://www.on3.com/college/florida-gators/news/billy-napier-confirms-he-will-remain-play-caller-has-not-considered-giving-up-duties/,https://on3static.com/uploads/dev/assets/cms/2025/09/08114510/USATSI_26800051-1.jpg,2025-09-08 16:49:34+00:00,"Florida Gators coach Billy Napier said he will remain the primary play-caller Monday. He said he has given no thought to changing that role, despite Saturdays 18-16 loss to USF.
In the loss, DJ Lagw… [+1435 chars]"
,Eleven Warriors,,Biff Poggi to Serve As Michigan’s Interim Head Coach During Sherrone Moore’s Two-Game Suspension | Eleven - Eleven Warriors,Biff Poggi will serve as Michigan's interim head coach while Sherrone Moore serves a self-imposed two-game suspension for his involvement in the Wolverines' sign-stealing scandal.,https://www.elevenwarriors.com/college-football/2025/09/157868/biff-poggi-to-serve-as-michigan-s-interim-head-coach-during-sherrone-moore-s-two-game-suspension,https://www.elevenwarriors.com/sites/default/files/styles/904x490/public/c/2025/09/157868_h_1.jpg?itok=fbUGkOqc,2025-09-08 16:48:32+00:00,Michigan head coach Sherrone Moore announced Monday that Biff Poggi will serve as Michigan's interim head coach while Moore serves a self-imposed two-game suspension for his role in the program's sig… [+1983 chars]
