source_id,source_name,author,title,description,url,urlToImage,publishedAt,content
,Android Central,Harish Jonnalagadda,"With the Pixel 10 Pro XL, Google finally made a faultless flagship - Android Central","It may not have groundbreaking upgrades, but the Pixel 10 Pro XL is an absolute delight to use.",https://www.androidcentral.com/phones/google-pixel/with-the-pixel-10-pro-xl-google-finally-made-a-faultless-flagship,https://cdn.mos.cms.futurecdn.net/KXqaiSix2JfjJLxiU6WLx9.jpg,2025-09-08 04:46:55+00:00,"(Image credit: Nicholas Sutrich / Android Central)
In Hardwired, AC Senior Editor Harish Jonnalagadda delves into all things hardware, including phones, audio products, storage servers, and networki… [+6984 chars]"
,Fitandwell.com,Lou Mudge,A personal trainer says this 30-minute walking workout will increase your calorie burn and enhance your joint mobility - Fit&Well,Hit your movement goals in just 30 minutes,https://www.fitandwell.com/exercise/walking/a-personal-trainer-says-this-30-minute-walking-workout-will-increase-your-calorie-burn-and-enhance-your-joint-mobility,https://cdn.mos.cms.futurecdn.net/k2ymUCCeFnMrTDKT3bGSyd.jpg,2025-09-08 04:03:59+00:00,"Want to make your next 30-minute walk more challenging? Turn it into a walking workout.
Walking workouts require a little more focus than your average stroll, but they can help you get more steps in… [+2389 chars]"
mashable,Mashable,Lois Mackenzie,"Moon phase today: What the moon will look like on September 8, 2025 - Mashable",The moon will start getting darker now.,https://mashable.com/article/moon-phase-today-sept-8,https://helios-i.mashable.com/imagery/articles/05cHBpNBrlUcfSlBKrtAFwq/hero-image.fill.size_1200x675.v1756735140.jpg,2025-09-08 04:00:28+00:00,
the-times-of-india,The Times of India,ETimes.in,Diabetes: Doctor reveals 10 very early signs and symptoms of high blood sugar one should never ignore - Times of India,"According the World Health Organisation, the global diabetes cases have increased four-fold over past decades.Highlighting how sedentary lifestyles and poor food choices have fueled the diabetes epidemic, WHO Director-General Dr Tedros Adhanom Ghebreyesus sai…",https://timesofindia.indiatimes.com/life-style/health-fitness/health-news/diabetes-doctor-reveals-10-very-early-signs-and-symptoms-of-high-blood-sugar-one-should-never-ignore/photostory/123721148.cms,https://static.toiimg.com/photo/123721169.cms,2025-09-08 03:02:26+00:00,"According the World Health Organisation, the global diabetes cases have increased four-fold over past decades.Highlighting how sedentary lifestyles and poor food choices have fueled the diabetes epid… [+745 chars]"
the-wall-street-journal,The Wall Street Journal,Stephen Wilmot,BMW and Mercedes Take On Tesla With New Luxury SUVs - The Wall Street Journal,Electric versions of the luxury brands’ bestsellers represent Europe’s boldest efforts yet to catch up with U.S. and Chinese technology,https://www.wsj.com/business/autos/bmw-mercedes-ev-suv-tesla-483024d9,https://images.wsj.net/im-54678999/social,2025-09-08 03:00:00+00:00,"TeslasTSLA-1.24%decrease; red down pointing triangle
Model Y was a game-changer in the auto industry, blowing away fusty old manufacturers to become the bestselling vehicle globally. Now the worlds … [+469 chars]"
the-times-of-india,The Times of India,TOI Lifestyle Desk,"3 myths of Fatty Liver Disease one needs to stop believing, as busted by AIIMS and Harvard Doctor - Times of India",People frequently believe that fatty liver disease develops because of consuming excessive fat in their diet. This is not true. Dr Sethi says that the,https://timesofindia.indiatimes.com/life-style/health-fitness/health-news/3-myths-of-fatty-liver-disease-one-needs-to-stop-believing-as-busted-by-aiims-and-harvard-doctor/articleshow/123756041.cms,"https://static.toiimg.com/thumb/msid-123756005,width-1070,height-580,imgsize-26668,resizemode-75,overlay-toi_sw,pt-32,y_pad-40/photo.jpg",2025-09-08 02:59:00+00:00,
,Variety,Thania Garcia,"Steven Tyler Holds Back Tears, Yungblud Brings the Energy in Emotional VMAs Ozzy Osbourne Tribute - Variety",Ozzy Osbourne was memorialized with an emotional performance tribute from Aerosmith's Steven Tyler and Joe Perry and Yungblud at the MTV VMAs.,https://variety.com/2025/music/news/steven-tyler-tears-vmas-ozzy-osbourne-tribute-1236509785/,https://variety.com/wp-content/uploads/2025/09/Screenshot-2025-09-07-at-10.27.13-PM-e1757298517687.png?w=1000&h=563&crop=1,2025-09-08 02:31:00+00:00,"How do you follow a mega-all-star tribute like the one the inimitable Ozzy Osbourne received in England in July? The VMAs chose their spots by enlisting a pair of suitable, generation-spanning pair o… [+2037 chars]"
the-times-of-india,The Times of India,TOI Lifestyle Desk,"51-year-old neurologist loses 30 kg through THIS simple, practical lifestyle changes; highlighting key ti - Times of India","Dr. Sudhir Kumar, a neurologist, shed 30 kilograms over two years by making practical lifestyle changes. He prioritized reducing work hours, improving",https://timesofindia.indiatimes.com/life-style/health-fitness/health-news/51-year-old-neurologist-loses-30-kg-through-this-simple-practical-lifestyle-changes-highlighting-key-tips/articleshow/123755364.cms,"https://static.toiimg.com/thumb/msid-123755392,width-1070,height-580,imgsize-29412,resizemode-75,overlay-toi_sw,pt-32,y_pad-40/photo.jpg",2025-09-08 01:44:00+00:00,
,49ers.com,,49ers Defeat Seahawks 17-13 in Season Opener; 5 Takeaways from #SFvsSEA - San Francisco 49ers,The San Francisco 49ers opened their 2025 season slate with a 17-13 win over the Seattle Seahawks at Lumen Field.,https://www.49ers.com/news/49ers-defeat-seahawks-17-13-in-season-opener-5-takeaways-from-sfvssea,https://static.clubs.nfl.com/image/upload/t_editorial_landscape_12_desktop/49ers/xtkovbx9ww9kijrjo2jt,2025-09-08 01:41:15+00:00,
,MacRumors,Joe Rossignol,Apple Watch SE 3 and More Seemingly Confirmed by Last-Minute Leak - MacRumors,A private account on X with a proven track record today shared alleged details about upcoming Apple Watch and iPad Pro models.   Here are the alleged...,https://www.macrumors.com/2025/09/07/apple-watch-se-3-last-minute-leak/,https://images.macrumors.com/t/Ql5xsiR3DS79zcfgNzknsvpk_34=/2250x/article-new/2023/10/Apple-Watch-SE-3-Mock-Feature.jpg,2025-09-08 01:38:46+00:00,"A private account on X with a proven track record today shared alleged details about upcoming Apple Watch and iPad Pro models.
Here are the alleged devices that the account mentioned:
<ul><li>Apple… [+1496 chars]"
,NBCSports.com,Mike Florio,Emeka Egbuka accomplishes rare feat in debut - NBC Sports,Buccaneers receiver Emeka Ebuka had a debut to remember on Sunday in Tampa's 23-20 win over the Falcons.,https://www.nbcsports.com/nfl/profootballtalk/rumor-mill/news/emeka-egbuka-accomplishes-rare-feat-in-debut,https://nbcsports.brightspotcdn.com/dims4/default/2222240/2147483647/strip/true/crop/3985x2242+0+208/resize/1440x810!/quality/90/?url=https%3A%2F%2Fnbc-sports-production-nbc-sports.s3.us-east-1.amazonaws.com%2Fbrightspot%2F26%2F5d%2F4b99fe4242d3bce75df6cc99593c%2Fhttps-api-imagn.com%2Frest%2Fdownload%2FimageID%3D27029421,2025-09-08 01:04:40+00:00,"Buccaneers receiver Emeka Ebuka had a debut to remember on Sunday in Tampas 23-20 win over the Falcons.
The 2025 first-rounder caught four passes for 67 yards and two touchdowns.
The second touchdo… [+444 chars]"
,9to5google.com,Abner Li,New ‘2K’ Nest Cams and Doorbell ‘with Gemini’ hit store shelves early - 9to5Google,"Ahead of the expected October 1 announcement, the rumored Nest Cam and Doorbell ""2K"" updates are already appearing in stores.",http://9to5google.com/2025/09/07/nest-cam-doorbell-2k/,https://i0.wp.com/9to5google.com/wp-content/uploads/sites/4/2025/09/google-new-nest-cam-teaser.jpg?resize=1200%2C628&quality=82&strip=all&ssl=1,2025-09-08 00:44:00+00:00,"Ahead of the expected October 1 announcement, the rumored Nest Cam and Doorbell “2K” updates are already appearing in stores.
The image below is from a Reddit user visiting Home Depot this weekend. … [+1558 chars]"
,Commanders.com,,Game balls | 3 standouts from Washington's Week 1 win over New York - Washington Commanders,"Defensive tackle Daron Payne, wide receiver Deebo Samuel Sr. and running back Jacory “Bill” Croskey-Merritt delivered strong performances in the Week 1 win.",https://www.commanders.com/news/game-balls-commanders-giants-week-1-2025,https://static.clubs.nfl.com/image/upload/t_editorial_landscape_12_desktop/commanders/jnpmnnkhgmyw6ojxum4k,2025-09-08 00:39:21+00:00,
,Digital Trends,Trevor Mogg,Watch SpaceX blast its Super Heavy booster for 11th Starship flight - Digital Trends,Sunday's test suggests the 11th Starship flight is just around the corner.,https://www.digitaltrends.com/space/spacex-test-super-heavy-for-flight-11/,https://www.digitaltrends.com/wp-content/uploads/2025/09/starship-super-heavy-flight-11-test.jpg?resize=1200%2C630&p=1,2025-09-08 00:35:00+00:00,
,SpaceNews,Jeff Foust,FAA approves increase in Falcon 9 launches while studying Starship environmental impacts - SpaceNews,The FAA approved a significant increase in Falcon 9 launches from one Florida pad as it takes public input on plans for Starship launches from another.,http://spacenews.com/faa-approves-increase-in-falcon-9-launches-while-studying-starship-environmental-impacts/,https://spacenews.com/wp-content/uploads/2025/09/f9-20250903.jpeg,2025-09-08 00:19:07+00:00,WASHINGTON The Federal Aviation Administration has approved a significant increase in Falcon 9 launches from one Florida launch pad as it takes public input on plans for Starship launches from anothe… [+5222 chars]
,BleepingComputer,Mayank Parmar,Google to make it easier to access AI Mode as default - BleepingComputer,"Google plans to make it easier for users to access AI mode by allowing them to set it as the default, replacing the traditional blue links.",https://www.bleepingcomputer.com/news/google/google-to-make-it-easier-to-access-ai-mode-as-default/,https://www.bleepstatic.com/content/hl-images/2025/09/04/Google-headpic.jpg,2025-09-08 00:07:54+00:00,"Google plans to make it easier for users to access AI mode by allowing them to set it as the default, replacing the traditional blue links.
AI mode is an advanced version of Google Search that uses … [+2458 chars]"
fortune,Fortune,Jason Ma,Dow futures rise as recession fears grow while Wall Street awaits the one thing that could derail Fed rate cuts - Fortune,"On Thursday, the consumer price index is due, and Wall Street sees a 0.3% gain, accelerating from the 0.2% pace a month earlier.",https://fortune.com/2025/09/07/stock-market-today-dow-futures-cpi-ppi-fed-rate-cuts-recession-inflation/,"https://fortune.com/img-assets/wp-content/uploads/2025/09/GettyImages-2232783307-e1757280449135.jpg?resize=1200,600",2025-09-07 23:52:00+00:00,Stock futures gained momentum on Sunday evening as investors brace for fresh inflation data and political turmoil overseas that could ripple through the bond market.That comes as Fridays dismal jobs … [+3288 chars]
,BBC News,,Donald Trump's tariffs put US manufacturing revival hopes to the test - BBC,The gulf between Trump's rhetoric and the reality on the ground is starting to show.,https://www.bbc.com/news/articles/c3rvdxz9589o,https://ichef.bbci.co.uk/news/1024/branded_news/2b2c/live/fea50c10-8c7f-11f0-84c8-99de564f0440.png,2025-09-07 23:38:33+00:00,"Natalie ShermanBBC News, Fall River, Massachusetts
Frank Teixeira and his daughter Sue Teixeira, co-owners of Fall River-based Accurate Services
In a corner of a cavernous 1890s factory in southern… [+6624 chars]"
the-times-of-india,The Times of India,TOI+Lifestyle+Desk,From Green tea to turmeric: 7 powerful foods that promise better memory and mental clarity - The Times of India,"While human beings consume multiple things for maintaining a healthy body,what often remains overlooked is brain health. Brain health influences your decision making, emotional intelligence and many more other aspects.Here are 8 foods that are excellent at de…",https://timesofindia.indiatimes.com/life-style/health-fitness/from-green-tea-to-turmeric7-powerful-foods-that-promise-better-memory-and-mental-clarity/photostory/123640032.cms,"https://static.toiimg.com/thumb/msid-123640055,imgsize-22060,width-900,height-1200,resizemode-6/123640055.jpg",2025-09-07 23:38:00+00:00,"The group of five fishes known as SMASH Fish-Salmon, Mackerel, Anchovy, Sardine, and Herring- are great for brain health due to their rich content of omega-3 fatty acids.These fishes are also low in … [+75 chars]"
,MMA Mania,Alexander Behunin,"Pic: UFC Noche’s Sedriques Dumas shares bank account, reveals he’s broke - ‘Price of being a adult’ - MMA Mania","UFC Middleweight Sedriques Dumas revealed just $13.96 in his bank account before Noche UFC 3, where he faces Zach Reese in a must-win fight",https://www.mmamania.com/latest-news/387888/pic-ufc-noches-sedriques-dumas-shares-bank-account-reveals-hes-broke-price-of-being-a-adult,https://platform.mmamania.com/wp-content/uploads/sites/110/2025/09/gettyimages-2209968169.jpg?quality=90&strip=all&crop=0%2C10.732984293194%2C100%2C78.534031413613&w=1200,2025-09-07 23:36:00+00:00,"Ultimate Fighting Championship (UFC) Middleweight Sedriques Dumas is fighting for more than pride this weekend hes fighting for his bank account.
Dumas returns to action against Zach Reese at Noche … [+1765 chars]"
,NPR,Chandelis Duster,"More than 90,000 Jeep Grand Cherokees recalled over potential loss of drive power - NPR",Vehicles impacted by the recall include 2022 to 2026 plug-in hybrid electric models of the Jeep Grand Cherokee.,https://www.npr.org/2025/09/07/nx-s1-5533180/jeep-grand-cherokee-recall-plug-in-hybrid,https://npr.brightspotcdn.com/dims3/default/strip/false/crop/5472x3078+0+278/resize/1400/quality/100/format/jpeg/?url=http%3A%2F%2Fnpr-brightspot.s3.amazonaws.com%2Fb7%2Fcc%2F49b3b482495c8a472bd6cf0c8215%2Fap24191584327784.jpg,2025-09-07 23:24:34+00:00,"More than 90,000 Jeep Grand Cherokees have been recalled because of a software error that could lead to ""loss of drive power"" and potential crashes, according to the U.S. National Highway Traffic Saf… [+1136 chars]"
,NASCAR,,Ryan Blaney keeping receipts after getting spun by Kyle Larson: 'That's just one I got to remember' - NASCAR.com,"After a fourth-place finish at Gateway, Ryan Blaney describes his spin off the fender of Kyle Larson and that he won't forget their dust-up.",https://www.nascar.com/videos/franchise/nascar-cup-post-race-reactions/ryan-blaney-keeping-receipts-after-getting-spun-by-kyle-larson-thats-just-one-i-got-to-remember/,https://www.nascar.com/wp-content/uploads/sites/7/2025/09/07/2025-sept7-ryan-blaney-prr-wwtr.jpg,2025-09-07 23:16:03+00:00,
,ScienceAlert,Peter Dockrill,The Cause of Alzheimer's Could Be Coming From Within Your Mouth - ScienceAlert,"In recent years, an increasing number of scientific investigations have backed an alarming hypothesis: Alzheimer's disease may not be merely a condition of an aging brain, but the product of infection.",https://www.sciencealert.com/the-cause-of-alzheimers-could-be-coming-from-within-your-mouth,https://www.sciencealert.com/images/2022/11/FingerPointsAtMouthXray.jpg,2025-09-07 23:15:38+00:00,"In recent years, an increasing number of scientific investigations have backed an alarming hypothesis: Alzheimer's disease may not be merely a condition of an aging brain, but the product of infectio… [+4045 chars]"
,GhanaWeb,,"Ban all hookup apps; foreigners are using them to expand prostitution, spread HIV – Group - GhanaWeb","An advocacy group known as Apex Citizens has called on Ghanaian authorities, particularly the Ministry of Communications, Digital Technology and Innovations, to take immediate action against “hookup apps.”",https://www.ghanaweb.com/GhanaHomePage/entertainment/Ban-all-hookup-apps-foreigners-are-using-them-to-expand-prostitution-spread-HIV-Group-1999612,https://cdn.ghanaweb.com/imagelib/pics/183/18389125.jpg,2025-09-07 22:03:06+00:00,"An advocacy group known as Apex Citizens has called on Ghanaian authorities, particularly the Ministry of Communications, Digital Technology and Innovations, to take immediate action against hookup a… [+2290 chars]"
,Science Daily,,Scientists just made CRISPR three times more effective - ScienceDaily,"Northwestern scientists have developed a new nanostructure that supercharges CRISPR’s ability to safely and efficiently enter cells, potentially unlocking its full power to treat genetic diseases. By wrapping CRISPR’s tools in spherical DNA-coated nanoparticl…",https://www.sciencedaily.com/releases/2025/09/250907024543.htm,https://www.sciencedaily.com/images/1920/genetic-engineering-dna-modification.webp,2025-09-07 21:06:52+00:00,<ul><li>CRISPR gene-editing machinery could transform medicine but is difficult to get into tissues and disease-relevant cells</li><li>New delivery system loads CRISPR machinery inside spherical nucl… [+6899 chars]
,Minneapolis Star Tribune,,"Readers Write: Vaccines, hit on Venezuelan vessel, James Dobson, women’s rights - Star Tribune",Florida rejects residents’ safety.,https://www.startribune.com/readers-write-vaccines-hit-on-venezuelan-vessel-james-dobson-womens-rights/601467710,https://arc.stimg.co/startribunemedia/X4Y5FSYUKVGINHZRHNS75TVZGM.JPG?&w=1200&ar=1.91:1&fit=crop,2025-09-07 21:02:43+00:00,"Mark Gortze, Champlin
In the Aug. 31 Remembering section it states that James Dobson advocated for strict discipline of children (Religious leader preached politics). To be clear, what Dobson advoca… [+2340 chars]"
,New York Post,Angela Tricarico,"How to watch Mark Ruffalo in ‘Task’ on HBO for free: Release time, streaming - New York Post","The new miniseries comes from the creator of another HBO hit, “Mare of Easttown.”",https://nypost.com/2025/09/07/entertainment/task-hbo-release-date-time-streaming-free/,https://nypost.com/wp-content/uploads/sites/2/2025/09/task-hbo.jpg?quality=75&strip=all&w=1024,2025-09-07 21:00:00+00:00,"New York Post may be compensated and/or receive an affiliate commission if you click or buy through our links. Featured pricing is subject to change.
Your only Sunday night task is to watch “Task.”… [+3233 chars]"
,Nintendo Life,Nintendo Life,Review: NBA 2K26 (Switch 2) - Brilliant B-Ball Has A Disappointing Debut On Switch 2 - Nintendo Life,Hoops!...they did it again,https://www.nintendolife.com/reviews/nintendo-switch-2/nba-2k26,https://images.nintendolife.com/e965577b9e1a7/1280x720.jpg,2025-09-07 20:16:01+00:00,"Captured on Nintendo Switch 2 (Docked)
As much as I can understand the derision from some quarters regarding NBA 2K26, FC 26, Madden any of these big sports' games in their yearly, money-grubbing mo… [+6486 chars]"
,Neurosciencenews.com,Neuroscience News,Artificial Sweeteners Tied to Faster Cognitive Decline - Neuroscience News,"A large study of nearly 13,000 adults found that consuming high levels of certain artificial sweeteners is linked to faster declines in memory and thinking over eight years.",https://neurosciencenews.com/artificial-sweeteners-cognitive-decline-29670/,https://neurosciencenews.com/files/2025/09/artificial-sweetener-cognition-neurosciecne.jpg,2025-09-07 20:12:21+00:00,"Summary: A large study of nearly 13,000 adults found that consuming high levels of certain artificial sweeteners is linked to faster declines in memory and thinking over eight years. The effect was p… [+7676 chars]"
cbs-news,CBS News,Kaia  Hubbard,"Top White House economic adviser Kevin Hassett says Fed monetary policy should be ""fully independent"" of presidents - CBS News","Director of the National Economic Council Kevin Hassett said the Federal Reserve's monetary policy ""needs to be fully independent of political influence — including from President Trump.""",https://www.cbsnews.com/news/kevin-hassett-white-house-national-security-council-fed-monetary-policy-face-the-nation/,https://assets1.cbsnewsstatic.com/hub/i/r/2025/09/07/500fb559-8fd8-4e9f-92f3-604567f243d3/thumbnail/1200x630/0091e54ac075d87c7f12d095ce5a6242/1757261147214.png,2025-09-07 19:23:00+00:00,"Washington — Director of the National Economic Council Kevin Hassett, who President Trump has said is on his shortlist to become the next chair of the Federal Reserve, said Sunday that the Federal Re… [+3514 chars]"
,Ambcrypto.com,Ritika Gupta,"Crypto market’s weekly winners and losers – PUMP, ZEC, PI, CRO - AMBCrypto",It was a dramatic week in the crypto market. Here’s how a few of your selected altcoins held up.,https://ambcrypto.com/crypto-market-weekly-review-7-september/,https://ambcrypto.com/wp-content/uploads/2025/09/Ritika2-3-1000x600.webp,2025-09-07 19:02:50+00:00,"Key Takeaways
MemeCore [M], Pump.fun [PUMP], and Zcash [ZEC] led the week with sharp price surges. In contrast, Conflux [CFX], Pi [PI], and Cronos [CRO] saw significant declines.
This week, the mar… [+5226 chars]"
bloomberg,Bloomberg,Michael MacKenzie,"Bullish Treasuries Traders Awaits Jobs Revisions, Inflation Data - Bloomberg.com",Emboldened investors in the Treasuries market face a test of bullish sentiment this week from inflation reports and a benchmark revisions for jobs data.,https://www.bloomberg.com/news/articles/2025-09-07/bullish-treasuries-traders-awaits-jobs-revisions-inflation-data,https://assets.bwbx.io/images/users/iqjWHBFdfxIU/iCkZAuovCBUg/v1/1200x800.jpg,2025-09-07 19:00:00+00:00,"Emboldened investors in the Treasuries market face a test of bullish sentiment this week from inflation reports and a benchmark revisions for jobs data.
Two- and 10-year yields ended last week at th… [+197 chars]"
,Good News Network,Good News Network,"Cheerful Music Could Help People Get Over Car Sickness, New Study Shows - Good News Network","Listening to happy tunes helped people with motion sickness get over their predisposition and recover better, according to new research.",https://www.goodnewsnetwork.org/cheerful-music-could-help-people-get-over-car-sickness-new-study-shows/,https://www.goodnewsnetwork.org/wp-content/uploads/2025/09/Headphones-driving-on-bus-car-sickness-by-Getty-Images-for-Unsplash-pmal3g5PnB4.jpg,2025-09-07 18:38:16+00:00,"By Getty Images for Unsplash+
Listening to happy tunes helped study participants with motion sickness get over their predisposition and recover better, according to new research.
Motion sickness is… [+4702 chars]"
,YourTango,Shape Magazine,"If Two People Are Truly In Love, They'll Unlock These 9 Pretty Awesome Health Perks - YourTango","Couples who share a true, deep love often enjoy surprising perks like lower stress and better sleep, among other pretty awesome health benefits, says scientific research.",https://www.yourtango.com/love/two-people-truly-love-unlock-these-pretty-awesome-health-perks,https://www.yourtango.com/sites/default/files/image_blog/2025-09/two-people-truly-love-soul-level-unlock-awesome-health-perks_0.png,2025-09-07 18:06:56+00:00,"Love makes us human. It sounds almost unbearably cheesy, but according to science, its kind of true from an evolutionary perspective, at least. 
Since the beginning of time, homo sapiens may have de… [+6219 chars]"
,MacRumors,Joe Rossignol,"Kuo: AirPods Pro 3 Coming Soon, But Bigger Upgrade Arriving Next Year - MacRumors","Apple plans to release AirPods Pro 3 this year, according to supply chain analyst Ming-Chi Kuo.   All signs point towards Apple unveiling the AirPods...",https://www.macrumors.com/2025/09/07/airpods-pro-3-this-year-per-kuo/,https://images.macrumors.com/t/hIwR4IeQMb-_sw0nBlu1BHty-QM=/2500x/article-new/2024/12/AirPods-Pro-3-Heart-Rate-Tracking-Feature.jpg,2025-09-07 17:52:24+00:00,"Apple plans to release AirPods Pro 3 this year, according to supply chain analyst Ming-Chi Kuo.
All signs point towards Apple unveiling the AirPods Pro 3 during its iPhone 17 event on Tuesday, Septe… [+2234 chars]"
,GSMArena.com,Peter,"Deals: Samsung Galaxy S25 FE and Tab S11 are here, we also look at alternatives - GSMArena.com news - GSMArena.com",The S25 FE skipped pre-orders and launched immediately - but that doesn't mean there are no early bird perks. Samsung announced the Galaxy S25 FE this...,https://www.gsmarena.com/deals_samsung_galaxy_s25_fe_and_tab_s11_are_here_we_also_look_at_alternatives-news-69366.php,https://fdn.gsmarena.com/imgroot/news/25/09/deals-5/-952x498w6/gsmarena_us.jpg,2025-09-07 17:52:02+00:00,"Samsung announced the Galaxy S25 FE this week, a more affordable variant of its flagship S-series. Also new this week are flagship tablets, the Galaxy Tab S11 and Tab S11 Ultra. Lets have a look at w… [+4610 chars]"
,Earth.com,,Scientists developed a blood test that identifies Alzheimer's disease in minutes - Earth.com,New analysis reveals that a simple blood test can detect Alzheimer's disease with up to 92% accuracy in normal clinics.,https://www.earth.com/news/scientists-developed-blood-test-that-identifies-alzheimers-disease-amyloid-in-minutes/,https://cff2.earth.com/uploads/2025/09/05041209/alzheimers-blood-test-lab-sample.jpg,2025-09-07 17:16:11+00:00,"Memory complaints show up in clinics every day. Today, about 57 million people live with dementia worldwide, and Alzheimers disease causes most cases.
Doctors rely on interviews, brief cognitive che… [+4961 chars]"
